Module,QuestionNo,Question,Correct Answer,Option A,Option B,Option C
11,1,Lift depends on:,B,forward speed and torque,forward speed and wing area,torque and wing area
11,2,"When aircraft is able to recover to its original steady flight, it is assumed to have:",B,negative stability,positive stability,neutral stability
11,3,"When an aircraft goes to an entirely different attitude, it is assumed to have:",A,negative stability,positive stability,neutral stability
11,4,Choose correct statement.,C,There is no relation between Dynamic and Static Stability,Dynamic Stability is an essential pre-requisite for static stability.," Static Stability is an essential pre-_x000D_
11	1	5	Pitch displacement is done around…..		x	x									x		B	longitidunal axis	 lateral axis	vertical axis_x000D_
11	1	6	Roll displacement is done around……							x	x						A	longitidunal axis	lateral axis	vertical axis_x000D_
11	1	7	Yaw displacement is done around…..							x	x						C	longitidunal axis	lateral axis	 vertical axis_x000D_
11	1	8	When aircraft maintains the displaced attitude, it is assumed to have:							x	x						C	negative stability	positive stability	 neutral stability_x000D_
11	1	9	Roll displacement is done by		x	x									x		C	rudder	elevator	 aileron_x000D_
11	1	10	pitch displacement is done by		x	x									x		B	rudder	 elevator	aileron_x000D_
11	1	11	yaw displacement is done by							x	x						C	aileron	elevator	 rudder_x000D_
11	1	12	primary controls are:		x	x									x		A	 rudder, elevator, aileron	rudder, elevator, flaperon	elevator, aileron, ruddervator_x000D_
11	1	13	Which statement is incorrect?							x	x						C	x axis= longitidunal	y axis = lateral	z axis = longitidunal_x000D_
11	1	14	secondary controls are:							x	x						B	thrust increasing devices	 lift increasing devices	drag decreasing devices_x000D_
11	1	15	which one is the secondary control?							x	x						A	 flap	aileron	elevator_x000D_
11	1	16	which one is the primary control?							x	x						B	flap	 rudder	spoiler_x000D_
11	1	17	which one is the drag increasing device?							x	x						B	slat	spoile	balance tab_x000D_
11	1	18	which device is controlled seperately?		x	x									x		A	 trim tab	balance tab	servo tab_x000D_
11	1	19	which device decreases lift?		x	x									x		C	slat	slot	 spoiler_x000D_
11	1	20	the quality of aircraft response to pilot’s input is…..							x	x						A	 controllability	stability	maneuvrability_x000D_
11	1	21	the ability to be flown as hands-off position in steady flight							x	x						B	controllability	 stability	maneuvrability_x000D_
11	1	22	the ability to be flown without stressing the aircraft structure							x	x						C	controllability	stability	 maneuvrabilit_x000D_
11	1	23	which aircraft should have high degree of stability?							x	x						C	light aircraft	fighter aircraft	 transport aicraft_x000D_
11	1	24	which aircraft should have lesser stability, higher controllability?							x	x						B	light aircraft	 fighter aircraft	transport aicraft_x000D_
11	1	25	when center of gravity(CG) moves to the center of pressure (CP)………							x	x						B	stability increases, controllability decreases	 stability decreases, controllability"
11,26,Longitidunal control is done by,B,Rudder, Elevator,Aileron
11,27,Lateral control is done by,C,Rudder,Elevator, Aileron
11,28,Directional control is done by,A, Rudder,Elevator,Aileron
11,29,what does «coordinated turn» mean?,B,combined effects of rudder and elevator, combined effects of rudder and flap,combined effects of rudder and spoiler
11,30,what is the reason for adverse yaw on aileron?,A, down going aileron creates more drag,down going aileron creates less drag,up going aileron creates more drag
11,31,what does MSG stand for?,C,Main System Group,Mission Support Group, Maintenance Steering Group
11,32,Aircraft is formed from main assemblies. Which one is not considered as main assembly?,B,landing gear,fin,engine
11,33,Aircraft is formed by,B,production assemblies, design assemblies,subassemblies
11,34,Production Assembly is formed by,A, assemblies,design assemblies,ubassemblies
11,35,assembly is formed by,C,production assemblies,design assemblies, subassemblies
11,36,subassembly is formed by,C,production assemblies,design assemblies, single parts/auxillary assembly
11,37,What does Major Zone 100 mean?,C,left wing,right wing,lower part of fuselage
11,38,What does Major Zone 200 mean?,A,upper part of fuselage,left wing,right wing
11,39,What does Major Zone 500 mean?,A,left wing,right wing,lower part of fuselage
11,40,What does Major Zone 600 mean?,B,left wing,right wing,lower part of fuselage
11,41,how do we call vertical reference lines which are used to locate main assemblies?,C,Water Lines,Buttock Lines,Fuselage Station Lines
11,42,horizontal reference lines which are in parallel with longitidunal axis are called as,A,Water Lines,Buttock Lines,Boom Lines
11,43,vertical reference lines to lateral axis which are located on both sides of aircraft originated from x axis are called as,B,Water Lines,Buttock Lines,Boom Lines
11,44,a member subject to bending is known as,A,beam,tie,strut
11,45,a member subject to compression is known as,C,beam,tie,strut
11,46,a member subject to tension is known as,B,beam,tie,strut
11,47,which force causes combined stress?,A, bending,compression,tension
11,48,force per unit area is known as,C,strain,tension,stress
11,49,rate of change in length as per original length is known as,A,strain,tension,stress
11,50,the primary stress that pulls the body apart is,B,strain,tension,stress
11,51,which stress is defined as the primary stress?,A,compression,torsion,bending
11,52,the time function which is repeated periodically is….,B,fatique,cycle,safe life
11,53,maximum stress up to which a material can withstand an infinite number of cycles is called as,A,endurance limit,fail limit,fail safe
11,54,the structure will support designated loads with any single member failed is known as,C,endurance limit,fail limit,fail safe
11,55,Which definition is known as the failure of materials due to cyclic changes?,A,fatique,cycle,safe life
11,56,the components whose failure will result in loss of the aircraft.,B,fail safe components,safe life components,stress cycle components
11,57,a form of construction in which a number of members are joined to form a rigid structure,B,monocoque,truss,semi-monocoque
11,58,all of the loads are carried in the outside skin of ……………,A,monocoque,truss,semi-monocoque
11,59,"In which structure, additionally stringers and longerons are built and skins are riveted to them?",C,monocoque,truss,semi-monocoque
11,60,"on modern aircraft, wing skins are fastened to the airframes by using flush or countersunk rivets in order to ensure……",B,more rigid structure,smoother surface,easier maintenance
11,61,wings are installed with wing spars so that they carry……..,A,bending loads,shear loads,compression loads
11,62,modern passenger aircrafts are installed with,A,cantilever wing,high wing with brace,low wing with brace
11,63,light aircrafts are installed with…..,B,cantilever wing,high wing with brace,ow wing with brace
11,64,empennage consists of ……,C,vertical stabiliser,horizontal stabilizer,all of them
11,65,what is the reason for electrical bonding between all aircraft parts?,C,to perform static build-up,to increase resistance against lightning strike,to eliminate electrical potential difference
11,66,deburring is a manufactured process and is done to…….,A,remove sharp edges of holes,remove coating before assembly,perform surface treatment
11,67,cable tension is adjusted after installation by means of?,C,push-pull rods,pulleys,turnbuckles
11,68,purpose of sealing between faces of components are,B,to prevent loss of pressure,all of them,to provide leak tightness
11,69,choose correct statement,B,"solid rivets carries low shear loads, while blind rivets carries high shear loads","solid rivets carries high shear loads, while blind rivets carries low shear loads","solid rivets carries high tension loads, while blind rivets carries low compression loads"
11,70,which one is considered as mechanical methods of joining?,C,fusion welding,soldering,riveting
11,71,"during adhesive bonding, high strength joints is obtained by means of……",A,termosetting resins,thermoplasting resins,elastomeric resins
11,72,protective treatment of aluminium alloys consists of……,C,"alodising, anodising, media blasting","alodising, anodising, sand blasting","alodising, anodising, cladding"
11,73,aluminium alloys can be protected from corrosion by coating with pure aluminium which is known as…….,C,galvanising,anodising,cladding
11,74,process of applying an oxide film by an electrolytic process is known as ……,B,galvanising,anodising,alodising
11,75,protective treatment of ferrous material includes…..,A,"painting, plating, galvanising","painting, plating, anodising","cladding, plating, galvanising"
11,76,the better combination of primer and top coats used in modern airplanes are…..,B,"wash primer, synthetic enamel","epoxy primer, polyurethane","epoxy primer,synthetic enamel"
11,77,pot life is the time betwen mixing and the using time. What is the pot life for polyurethane?,A,6-8 hours,2-4 hours,12-14 hours
11,78,"for aircraft exterior cleaning, a mixture of water and emulsion cleaner is used. What is the ratio of them?",C,"0,043055556",1:8 or 1:10,1:5 or 1:3
11,524,What kind of seal is used on firewall bulkheads?.,B,None is required.,Fire-proof grommets.,Soft rubber.
11,525,he two stages in a good adhesive bond are.,B,wetting and gripping.,wetting and Setting.,spreading and setting.
11,526,"Prior to aluminium alloy bonding, we use.",A,acid etch.,alkaline etch.,solvent etch.
11,527,The purpose of a primer is to.,B,provide flexible surface for the top coat.,help bonding of the topcoat.,provide shiny surface for the topcoat.
11,528,Most large transport aircraft skins are.,C,7075.,5056.,2024
11,529,"Which of the following statements is correct, in relation to PLI washers used in critical bolted joints?.",A,PLI washers can only be used with self locking nuts and the washers should be used once.,PLI washers can be affected by thread or nut friction or by lubrication.,"PLI washers can be used more than once, providing they are used in critical bolted joints."
11,530,What opposes buckling in a semi-monocoque structure?.,C,Bulkheads.,Frames,Stringers.
11,531,"In a monocoque structure, which component carries the majority of the loads?.",C,Longerons.,Stringers.,Skin.
11,532,Which anti-corrosive treatment is found on alloy steels?.,C,Nickel plating.,Zinc plating.,Cadmium plating.
11,533,What material can be chromated as a protection against corrosion?.,C,Aluminium alloys.,Ferrous alloys.,Magnesium alloys.
11,534,"When carrying out a symmetry check on a large aircraft, what method of measurement is normally used?.",C,Lateral alignment method.,Longitudinal alignment method.,Steel tape and spring balance.
11,535,Paint remover substances.,B,are not damaging to any aircraft parts.,are damaging to some aircraft parts.,should only be used once.
11,536,Battery trays are.,C,absorbent to soak up electrolyte.,metal for earthing purposes.,metal with PVC coating and anti corrosive paint.
11,537,The primary purpose of sealant in use in pressurised aircraft is.,A,to seal the cabin.,B. to prevent corrosion.,to provide external streamlining.
11,538,"When installing a 'Hi-lock' bolt, it is necessary to.",C,lubricate the collar.,lubricate the shank and threads.,simply fit the bolt as they are prelubricated.
11,539,Sealant or levelling compound is installed during structure repair.,C,according to separate manufacturer's documentations such as BAC.,according to SB instructions.,according to AMM and SRM chapter 51.
11,540,"A bonded waffle doubler, as well as acting as a skin strengthener, also acts as a.",A,tear stopper.,jury strut.,shear tie.
11,541,What are the faying surfaces of a repair?.,B,Middle of repair.,Material under repair.,Edges of repair metal.
11,542,Why is a joggle joint used?.,A,Smooth contour of surface.,Added strength,So countersunk rivets do not need to be used.
11,543,The ideal conditions for paint spraying an aircraft are.,A,15°C to 25°C and humidity below 75%.,20°C to 30°C and humidity below 70%.,15°C to 25°C and humidity above 60%.
11,544,What are the types of true bonded joints?.,B,Cemented and specific.,Mechanical and specific.,Mechanical and cemented.
11,545,Why is a joggle joint used?.,A,To provide a flush fit.,To provide a smooth contour to surface.,To add strength.
11,546,"When both sides of a structural repair are not easily reached, which type of fastener would you use?.",A,Blind rivet.,Hi lock bolt.,Pop rivet.
11,547,With regard to extraneous spilt fluids.,A,they may be harmful to the aircraft structure.,"they can be ignored, they provide extra protection.",they should only be cleaned up if they are on the external surface of the aircraft
11,548,Skin panels may be strengthened by.,A,stringers.,struts.,cleats.
11,549,What is the normal form of construction of a spar?.,C,One boom mounted under a web.,Two webs separated by a boom.,Two booms separated by a web.
11,550,A crack stopper is fitted.,C,"after a crack starts, to slow its rate of propagation.","before a crack starts, to prevent its initiation.","before a crack starts, to slow its rate of propagation."
11,551,Which of the following should be accomplished before jacking an aircraft?.,A,Install critical stress panels or plates.,Remove all optional equipment.,Determine the fuel tanks are empty.
11,552,"Synthetic resins are made from nylon, vinyl and.",C,asphalt.,cellulose.,acrylics.
11,553,One of the advantages of the semi-monocoque construction is that it.,B,is easier to manufacture.,shares the loads.,takes all the loads in the skin.
11,554,"In a fully monocoque fuselage, all the loads are carried by the.",B,frames.,skin.,longerons.
11,555,Intercostals are.,B,vertical struts joining the upper and lower wings of a biplane.,longitudinal fuselage members attached at each end to adjacent frames.,compression ribs in cantilever wings.
11,556,Joints that are designed to stop the propagation of cracks are known as.,C,crack limiting joints.,secondary joints.,failsafe joints.
11,557,"If an aircraft has alkaline batteries, the battery compartment drain pipes will be.",B,aluminium alloy.,stainless steel.,plastic.
11,558,An overweight landing is one in which the aircraft has.,B,a missed placed centre of gravity on landing.,too much kinetic energy on landing.,an excessive fuel load on take-off.
11,559,Symmetry checks should be carried out.,C,in the hangar with the aircraft on its wheels.,on the ramp with the aircraft on its wheels.,in the hanger with the aircraft on jacks.
11,560,The purpose of a wash primer and primer is to.,A,help bonding for top-coat.,provide more aerodynamic finish for top-coat.,provide a flexible surface for top-coat.
11,561,Dents are generally not permitted in a tubular member.,C,if the major axis of the dent is parallel to the tube axis irrespective of the location.,if they are located in the middle third of the length of the member.,if they are located in the end thirds of the length of the member.
11,562,"When an item is cocooned, the visual indicator will indicate.",A,humidity.,toxic gases.,temperature.
11,563,The maximum permissible bow in a steel tube is.,B,1 in 400.,1 in 600.,1 in 200.
11,564,Buckling in a semi-monocoque structure is prevented by.,C,longerons.,bulkheads.,stringers.
11,565,Which loads do longerons resist?.,A,"Bending, compression and tensile.",Torsional only.,"Bending, compression, tensile and torsion."
11,597,Which loads do longerons resist?.,A,"Bending, compression and tensile.",Torsional only.,"Bending, compression, tensile and torsion."
11,79,what is the disadvantage of composite material?,C,low stability,heavier,bad electric conductivity
11,80,structural integrity of an aircraft must be capable of safely absorbing downward loads up to……..,C,9g,"1,5g – 3g","4,5g – 6g"
11,81,Minimum load carrying requirement for seats at forward direction is ……..,A,9g,"1,5g – 3g","4,5g – 6g"
11,82,Plug type doors are the doors………,A,"opening first inside, then outside",opening inside only,opening outside only
11,83,Type I emergency exit in passenger aircraft has a dimension of……,A,at least 24 inches wide by 48 inches high,at least 20 inches wide by 48 inches high,at least 10 inches wide by 48 inches high
11,84,Type A emergency exit in passenger aircraft has a dimension of……,C,at least 24 inches wide by 48 inches high,at least 20 inches wide by 72 inches high,at least 42 inches wide by 72 inches high
11,85,Emergency exits must be operable…….,A,from outside and inside within 90 seconds,from outside and inside within 10 seconds,from inside within 10 seconds with cockpit window
11,86,All emergency exits must be provided with evacuation aids when ……,C,aircraft has passengers more than 300,aircraft has a certificate to fly above 30 000 feet,exceeding 1.8m distance from the floor
11,87,According to Bird Bagging Concept in windows…,B,energy of impact is absorbed by heated acrylic layer,energy of impact is absorbed by heated vinyl layer,energy of impact is not absorbed and bird is thrown back because of the stiffness of the pane
11,88,According to Bird Bouncing Concept in windows…,C,energy of impact is absorbed by heated acrylic layer,energy of impact is absorbed by heated vinyl layer,energy of impact is not absorbed and bird is thrown back because of the stiffness of the pane
11,89,"In pressurized aircraft, windows are designed from",B,layers resisting upto 5 psi differential pressure,multi layers and safe life structure,layers resisting upto 14 psi differential pressure
11,90,spare panes for windows must be stored carefully. Find incorrect statement.,C,protection foil to both sides,packed in acid-free paper,preserved by an autowax
11,91,where does arcing normally occur?,A,near the windows bus bar and identified by dark brown or black spots,near the windows bus bar and identified by clear brown or red spots,near the battery bus bar and identified by white spots
11,92,bubbles on the windows occur when…..,C,overpressurisation in cabin pressurisation system,differential stresses among different panes,overheating due to malfunction of heating system
11,93,crazing only occurs on surface of acrylic panes and treated by……,A,polishing,etching,sand blasting
11,94,Lateral Stability is increased by installing…,B,anhedral wing,dihedral wing,gull wing
11,95,Controllability is increased by installing…,A,anhedral wing,dihedral wing,gull wing
11,96,wing aspect ratio is calculated by…,C,Mean Aerodynamic Chord by wing span,chord length divided by wing span,wing span divided by chord length
11,97,"In order to reduce wing tip vortices, we prefer…",A,high aspect ratio,low aspect ratio,high swept angle
11,98,which statement is not correct regarding truss type construction?,B,known as steel tube truss frame,all loads are carried by skin panel,all forces are carried by steel frame
11,99,wing load is the ratio of…….,B,wing area to gross weight,gross weight to wing area,useful load to wing span
11,100,What is MAC ?,A,relative chord on which all loads are applied,mean of leading edge and trailing edge,75% of total wing length
11,101,Find incorrect statement.,A,monocoque construction ( below 150 km/h),truss type construction (upto 150 km/h),spar type construction ( upto 400 km/h)
11,102,"which component is formed by spars, ribs, etc?",C,aileron,elevator,wing
11,103,wing shell construction is formed from…..,B,"thinner skin, ribs, foam","thicker skin, ribs, stringers","spars, ribs, stringers"
11,104,stringers and reinforcement sheets are manufactured from one piece using milling machine,A,integral wing,sandwich wing,shell wing
11,105,disadvantage of integral wing is ……,C,weight,rivet holes,cost
11,106,the composite construction of two surface panels with an interim supporting layer like spar and ribs is called..,B,integral wing,sandwich wing,shell wing
11,107,horizontal stabiliser provides stability…,B,around vertical axis with lateral stability,around lateral axis with longitidunal stability,around vertical axis with longitidunal stability
11,108,stabiliser assembly consists of …….,A,"box spar assembly, stringers, ribs","spars, ribs, longerons","box spar assembly, longerons, bulkhead"
11,109,"when we rotate elevator trim wheel, tail load is changed so that pilot flies at hands off position.                                                                 What is the effect of trim in the cockpit controls?",B,cockpit control moves accordingly,cockpit control moves accordingly in flight only,cockpit control does not move
11,110,design of this wing flap does not only change the camber of the wing but also increases wing area.,C,Plain Flap,Slotted Flap,Fowler Flap
11,111,what is the difference between slat and leading edge flap?,C,Slat causes vortex in the upper surface of wing while LE Flap causes lift.,Slat has air gap while LE Flap has no gap.,LE Flap has air gap while slat has no gap.
11,112,what is the purpose of winglet in modern aircraft?,A,winglet blocks tip vortices and decrease induced drag,winglet blocks tip vortices and increase induced drag,winglet increases lateral stability
11,113,one of the parts of engine nacelle is…..,A,nose cowling,inlet guide vanes,exhaust cone
11,114,what is the purpose of inlet cowl?,B,to redirect the air and decrease the pressure,to redirect the air and increase the pressure,to slow down the air and increase temperature
11,115,what is the purpose of pylon?,C,to attach cowlings to engine,to attach nacelle to the engine,to attach nacelle and engine to the wing
11,116,engine is mounted to the aircraft pylon with…,A,1 forward mounting bracket and 1 aft bracket,2 forward mounting brackets and 1 aft bracket,1 forward mounting bracket and 2 aft brackets
11,566,What kind of seal is used on firewall bulkheads?.,B,Soft rubber.,Fire-proof grommets.,None is required.
11,567,The two stages in a good adhesive bond are.,A,wetting and Setting.,wetting and gripping.,spreading and setting.
11,568,"Prior to aluminium alloy bonding, we use.",A,acid etch.,alkaline etch.,solvent etch.
11,569,The purpose of a primer is to.,C,provide shiny surface for the topcoat.,provide flexible surface for the top coat.,help bonding of the topcoat.
11,570,"In semi-monocoque construction, compression loads are taken by.",A,stringers.,bulkheads.,frames.
11,571,Most large transport aircraft skins are.,A,2024,7075.,5056.
11,572,"Which of the following statements is correct, in relation to PLI washers used in critical bolted joints?.",B,PLI washers can be affected by thread or nut friction or by lubrication.,PLI washers can only be used with self locking nuts and the washers should be used once.,"PLI washers can be used more than once, providing they are used in critical bolted joints."
11,573,What opposes buckling in a semi-monocoque structure?.,A,Stringers.,Bulkheads.,Frames.
11,574,"In a monocoque structure, which component carries the majority of the loads?.",C,Longerons.,Stringers.,Skin.
11,575,Which anti-corrosive treatment is found on alloy steels?.,B,Zinc plating.,Cadmium plating.,Nickel plating.
11,576,What material can be chromated as a protection against corrosion?.,B,Aluminium alloys.,Magnesium alloys.,Ferrous alloys.
11,577,"When carrying out a symmetry check on a large aircraft, what method of measurement is normally used?.",C,Lateral alignment method.,Longitudinal alignment method.,Steel tape and spring balance.
11,578,Paint remover substances.,B,are not damaging to any aircraft parts.,are damaging to some aircraft parts.,should only be used once.
11,579,The primary purpose of sealant in use in pressurised aircraft is.,A,to seal the cabin.,to prevent corrosion.,to provide external streamlining.
11,580,"When installing a 'Hi-lock' bolt, it is necessary to.",C,lubricate the collar.,lubricate the shank and threads.,simply fit the bolt as they are prelubricated.
11,581,What are the faying surfaces of a repair?.,B,Middle of repair.,Material under repair.,Edges of repair metal.
11,582,Dissimilar metal fusion bonding is best for.,B,low strength high toughness.,high strength high ductility.,high strength high toughness.
11,583,The ideal conditions for paint spraying an aircraft are.,A,15°C to 25°C and humidity below 75%.,20°C to 30°C and humidity below 70%.,15°C to 25°C and humidity above 60%.
11,584,What are the types of true bonded joints?.,B,Cemented and specific.,Mechanical and specific.,Mechanical and cemented.
11,585,"When both sides of a structural repair are not easily reached, which type of fastener would you use?.",A,Blind rivet.,Hi lock bolt.,Pop rivet.
11,586,With regard to extraneous spilt fluids.,A,they may be harmful to the aircraft structure.,"they can be ignored, they provide extra protection.",they should only be cleaned up if they are on the external surface of the aircraft.
11,587,Skin panels may be strengthened by.,A,stringers.,struts.,cleats.
11,588,Which of the following should be accomplished before jacking an aircraft?.,A,Install critical stress panels or plates.,Remove all optional equipment.,Determine the fuel tanks are empty.
11,589,"Synthetic resins are made from nylon, vinyl and.",C,asphalt.,cellulose.,acrylics.
11,590,"In a fully monocoque fuselage, all the loads are carried by the.",B,frames,skin.,longerons.
11,591,An overweight landing is one in which the aircraft has.,B,a missed placed centre of gravity on landing.,too much kinetic energy on landing.,an excessive fuel load on take-off.
11,592,Symmetry checks should be carried out.,C,in the hangar with the aircraft on its wheels.,on the ramp with the aircraft on its wheels.,in the hanger with the aircraft on jacks.
