Module,QuestionNo,Question,Correct Answer,Option A,Option B,Option C
11,1111,When the inertial platform is torqued to perform like a Schuler pendulum.,C,the platform rotates with respect to the aircraft.,the platform remains fixed with respect to the local vertical.,the platform oscillates with respect to the local vertical.
11,1112,A Schuler pendulum has a period of oscillation of.,C,8.4 minutes.,84.4 seconds.,84.4 minutes.
11,1113,An IN system requires data from the.,A,air data computer.,Doppler system.,satellites.
11,1114,"When in manual mode, the C.D.U. alert lamp of the IN system will flash.",C,when an error is detected.,thirty seconds before a track change is required.,two minutes before the next waypoint.
11,1115,TK (cross track) is the.,A,perpendicular distance from the desired track.,angle in degrees that aircraft track is left or right of desired track.,actual track across the earth's surface.
11,1116,The output of an INS can be fed to.,A,attitude indicators.,vertical speed indicators.,altimeters.
11,1117,The three accelerometers on a strapdown platform are mounted.,A,90º to each other.,120º apart.,parallel to each other.
11,1118,A basic I.N.S. platform has.,B,3 axis accelerometer.,2 accelerometers and 3 gyros.,3 accelerometers and 2 gyros (pitch and roll).
11,1119,Using I.N.S. an aircraft flies.,C,course directed by ground station.,rhumb line.,great circle arc.
11,1120,What must be entered in to the I.N.S. before the aircraft moves?.,A,Present position.,E.T.A.,Waypoints.
11,1121,Selection of the INS Mode Selector Unit (MSU) to ATT REF is made.,C,to feed information to the Captain and 1st Officers ADI displays.,when attitude information is lost.,when navigation information is lost.
11,1122,"For the INS, the Battery Unit provides.",B,"standby power only when on the ground, to maintain the alignment phase.",both when airborne and on the ground.,"standby power when airborne, switched by weight-off switches in the undercarriage."
11,1123,Control Display Unit (CDU) selection of TKE displays.,C,difference in degrees from True North in a clockwise direction from the desired track.,distance perpendicular from the selected track.,difference in degrees that the aircraft track is to the right or left of the desired track.
11,1124,The Earth Rate Compensation is computed from.,A,the earth's rotational rate (15°/hour) times the sine of the longitude.,the earth's rotational rate (15°/hour) times the cosine of the latitude.,the earth's rotational rate (15°/hour) times the sine of the latitude.
11,1125,INS wind speed is calculated from.,A,the vectorial addition of TAS and GS.,the vectorial addition of IAS and TAS.,the vectorial addition of IAS and GS.
11,1126,Centripetal error compensation is achieved by.,A,an additional signal is added to the N/S accelerometer to cancel the centripetal error.,allowing the platform to oscillate at a fixed rate.,the platform is torqued to align the N/S accelerometer along its insensitive axis.
11,1127,Transport Rate compensation is achieved by.,C,an additional signal added to the N/S accelerometer output depending on heading.,allowing the platform to oscillate at a fixed rate.,the platform being torqued by a computed torquing signal.
11,1128,If the battery fails on the ground (INS System).,A,a red warning light appears on the MSU and a horn sounds.,an amber light appears on the MSU and a horn sounds.,a red light appears on the CDU and a horn sounds.
11,1129,An IRS alignment.,A,takes 10 minutes and present position can be entered any time during the alignment.,takes 10 minutes and present position must be entered before alignment.,takes 10 minutes and the previous flight shut down present position is used for the alignment.
11,1130,For an IRS system to pass the 'Alignment System Performance Test' the.,A,latitude entered must be within given limits of the latitude computed by IRU.,the No. 1 and No.2 must both have the same latitude and longitude present position entered.,entered present latitude and longitude must agree with the latitude and longitude at the last power down.
11,1131,A laser gyro dither mechanism ensures that.,C,that the two contra-rotating beams each operate at different frequencies.,the contra-rotating beams are synchronised together.,optical 'backscatter' does not cause the contra-rotating beams to lock together.
11,1132,The localiser deviation signal for the flight director comes from the.,C,flight director computer.,VHF comm system.,VHF nav system.
11,1133,The heading error signal used in the heading select mode.,B,is the difference between the desired course and the actual course.,is the difference between the desired heading and the actual heading.,comes direct from the compass system.
11,1134,The crab angle of the aircraft during VOR or LOC modes is displayed by the.,A,difference between the course arrow and aircraft heading.,difference between the selected heading and aircraft heading.,selected course counter.
11,1135,VOR left-right deviation signals come from the.,C,DME system.,VLF nav system.,VHF nav set.
11,1136,"Above the glideslope, the ILS glideslope signal modulation is.",A,90 Hz.,90 KHZ.,150 Hz.
11,1137,"The localiser modulation signal to the left of the localiser centre line, as seen from the localiser transmitter, is.",A,150 Hz.,90 Hz.,90 KHz.
11,1138,"The correct sense demand generated for a selected heading 180°, when the aircraft heading is 150° is.",B,straight ahead.,turn right.,turn left.
11,1139,When an aircraft is flying along the extended centre line of the runway it is in the.,A,equi-signal sector.,90 Hz modulation sector.,150 Hz modulation sector.
11,1140,The localiser system offers approach guidance to the runway in terms of.,C,the vertical plane.,distance to touch down.,the horizontal plane.
11,1141,The glideslope transmitter is located.,A,adjacent to the touch-down point of the runway.,at the end opposite to the approach end of the runway.,at the approach end of the runway.
11,1142,The glideslope and localiser frequencies.,C,are fixed and common to all runways therefore frequency selection is not necessary.,have to be selected separately.,are paired and one frequency selector suffices for both.
11,1143,The glideslope system offers approach guidance to runways in terms of.,B,the horizontal plane.,the vertical plane.,distance to touchdown.
11,1144,The glideslope equipment operates in the.,C,VHF band.,HF band.,UHF band.
11,1145,The aircraft equipment determines the bearing of a ground station by comparing.,C,the phase of one 30 Hz modulation with that of a 9960 Hz modulation.,the amplitude of two 30 Hz modulations.,the phase of two 30 Hz modulations.
11,1146,The number of different radials provided by a ground station is.,A,infinite.,360.,"180 per quadrant, i.e. 720 in 360°."
11,1147,Which of the following frequencies is allocated to VOR?.,C,103.9 MHz.,127.2 MHz.,114.3 MHz.
11,1148,Aerial masts may be damaged by.,B,killfrost anti-icing fluid.,Skydrol hydraulic fluids.,water.
11,1149,Most radio aerial masts are.,C,insulated from the fuselage.,not bonded.,bonded.
11,1150,When an aircraft is heading due north (magnetic) towards a VOR station the reference and variable signals will be.,B,270° out of phase.,180° out of phase.,in phase.
11,1151,The middle marker modulation is keyed with.,C,dots.,dashes.,alternate dots and dashes.
11,1152,The modulation of the outer marker is.,A,400 Hz.,1300 Hz.,3000 Hz.
11,1153,The approximate distance of the middle marker from the runway threshold is.,C,7 miles.,3 miles.,3500 ft.
11,1154,Marker information is usually provided to the pilot.,C,visually.,aurally.,both visually and aurally.
11,1155,An over station sensor (OSS) detects.,B,radio deviation signals proportional to distance from a localiser transmitter.,the rapid rate of the VOR signal over the cone of confusion.,radio deviation signals proportional to distance from a VOR transmitter.
11,1156,Incompatible Flight Director modes are.,C,VRU and compass.,VOR and glidepath.,altitude hold and ILS.
11,1157,The VOR system comprises.,C,reference phase signal.,variable phase signal.,variable and reference phase signals.
11,1158,The most sensitive system between ILS and VOR is.,B,they both have the same sensitivity.,ILS.,VOR.
11,1159,"If an aircraft is flying on a heading of 000 away from a VOR station, the TO/FROM indicator would show.",B,no indication.,from.,to.
11,1160,How does the flight director computer differentiate between VOR and ILS frequencies?.,B,Discriminator on control panel.,Frequency discriminator in receiver.,Trigger pulse from ground station.
11,1161,The glideslope transmitter operates on.,B,frequencies of 108 to 118 MHZ.,the UHF band.,the VHF band.
11,1162,The pilots instinctive autopilot disengage button is on the.,B,left of the control column.,side of the controls away from the throttles.,right of the control column.
11,1163,"If the autopilot automatically disconnects in the autoland mode, the audible warning.",B,can only be switched off by re-engaging the autopilot.,is switched off by the instinctive cut-out button.,switches off after a time interval.
11,1164,A category 3B aircraft using fail operational automatic landing equipment will have.,C,a decision height depending on RVR.,no decision height.,a decision height of 50ft.
11,1165,"For an aircraft to be certified for automatic landing, an autothrottle system is.",C,a matter of choice for the operator.,mandatory.,dependent on the operation of the aircraft at slow speeds.
11,1166,"During ATC transponder operation, side lobe suppression acts to.",A,mute the DME operation during transmit phase.,supply altitude readout.,mute coms transmission during transponder operation.
11,1167,During operation of a twin HF radio system transceiver.,A,#1 HF system operation is inhibited during #2 operation.,#1 HF system can transmit but not receive.,both systems can be operated simultaneously.
11,1168,L band DME transmits on a frequency of.,C,2210 MHz.,4133 MHz.,1090 MHz.
11,1169,Function of ADF & VOR and DME in navigation system with reference to aircraft and beacon is;.,A,the first provides bearing line from aircraft to beacon and latter provides distance between aircraft and beacon.,the first provides distance between aircraft and beacon and latter provides bearing line from aircraft to beacon.,None of above.
11,1170,Which two frequencies are paired?.,C,DME and Glideslope.,Localizer and DME.,Glideslope and localizer.
11,1171,Localizer beam width is the angle where the two edges of beam are apart at the runway threshold by.,A,700 ft.,7 ft.,70 ft.
11,1172,What happens if frequency decreases without altering the physical length of aerial?.,A,The aerial becomes capacitively reactive.,The aerial becomes inductively reactive.,The aerial becomes inductively capacitive.
11,1173,"Aerials provide optimum output at one particular frequency, when its load is purely.",A,resistive.,inductive.,capacitive.
11,1174,The torque pre-set in an autopilot system is.,B,to stop the motor overheating.,to allow it to be overridden at a certain force.,to give control surface feel.
11,1175,Most aerials are.,A,bonded.,made from non-conductive material.,not bonded.
11,1176,The Middle Marker beacon is what colour?.,C,White.,Blue.,Amber.
11,1177,Laser gyros have.,A,no rotating parts.,rotating parts.,moving parts.
11,1178,Laser gyros are aligned to.,C,magnetic north.,true north.,aircraft structure.
11,1179,Triplex autopilot is.,A,fail operational.,fail soft.,fail passive.
11,1180,Flight management control system (FMCS) utilises.,C,"VOR, ADF, DME.","ILS, VOR, ADF.","ILS, DME, ADC."
11,1181,ACARS is.,B,a satellite communication system.,a way of reporting defects to maintenance base in flight.,a navigation system.
11,1182,Where is an ATC transponder mode 'A' selected ON?.,B,The altimeter.,The ATC control panel.,The airspeed indicator.
11,1183,How many data bases are required in an FMS system?.,C,3 (one is used for redundancy).,1.,2.
11,1184,What channel of the autopilot does the glideslope control?.,B,Roll.,Pitch.,Yaw.
11,1185,What is secondary radar?.,A,Signal returned from a transponder.,A backup radar on an airfield.,Reflected radar bounce from an aircraft.
11,1186,"In an autothrottle system, when is EPR or thrust mode used?.",B,Approach.,Take-off.,Cruise.
11,1187,What is Mode 1 & 2 of GPWS used for?.,A,"Excessive descent rate, excessive terrain closure rate.","Excessive descent rate, unsafe terrain clearance.","Excessive terrain closure rate, altitude loss after take-off."
11,1188,For radio communication over a distance of over 250 miles we use.,B,VHF.,HF.,VLF.
11,1189,"Autopilot, when on approach to landing, how many axis are used?.",C,2.,4.,3.
11,1190,A lead-acid battery is considered to be fully charged when the.,B,cells begin to gas freely.,SG and voltage remain constant for specified period.,SG reaches 1.180.
11,1191,The preferred method of battery charging a Ni-Cad battery is constant.,B,voltage.,current.,power.
11,1192,"When a current transformer is disconnected, what should be done?.",A,Terminals shorted.,Resistor placed across terminals.,Left open circuit.
11,1193,What does the differential sensing coil sense?.,C,Power.,Volts.,Current.
11,1194,Where does the GCU gets its power?.,C,RAT.,Battery.,PMG.
11,1195,Galley loads are wired in.,A,parallel so load shedding will lower current consumption.,either series or parallel depending on the design.,series.
11,1196,A fuse-type current limiter.,C,can be used as a radio suppressor.,limits current flow to a load.,opens a circuit after a time/current condition has been exceeded.
11,1197,"When a load is shed from a busbar, the.",B,busbar voltage decreases.,current consumption from the bar decreases.,busbar voltage increases.
11,1198,"In unparalleled AC generation systems, the phase rotation of one generator in relation to the others.",B,must be synchronised prior to paralleling.,is unimportant.,must be BCA.
11,1199,"In a multi-generator system, the generator which takes more than its reactive power share is protected by.",A,over-voltage and under-voltage protection circuits.,over-current and under-current protection circuits.,over-excitation and under-excitation protection circuits.
11,1200,Sharing of electrical loads by paralleled DC generators is controlled by.,A,equalising circuits which control the field excitation of the generators.,automatic load shedding.,equalising circuits which control the speed of the generators.
11,1201,Excessive commutator sparking can be caused by.,C,rotating field diode failure.,brushes positioned on MNA.,weak spring tension.
11,1202,Before checking the SG of a battery recently removed from an aircraft.,A,take the temperature of the electrolyte.,carry out a capacity test.,allow to stabilise for one hour.
11,1203,"On an AC external power plug, the interlock circuit is controlled by pins.",C,AB.,CD.,EF.
11,1204,Over-voltage protection circuits are activated.,C,before the over voltage limit is exceeded.,after a fixed time delay.,dependent on the magnitude of the overvoltage.
11,1205,A diode connected across a coil will.,B,suppress arching when relay is opening and closing.,prevent back EMF and allow faster switching.,prevent the coil being fitted the wrong way.
11,1206,Which fault does not always trip the GCR?.,C,Under-frequency and under-volts.,Over-frequency and over-volts.,Over-frequency and under-frequency.
11,1207,Differential protection in a generating system.,A,detects current difference between source and load.,detects voltage difference between source and load.,uses the volts coil to trip the GCR.
11,1208,Open phase sensing on a current transformer.,A,is detected on generator neutral circuit.,is detected using all phases.,is detected using any phase.
11,1209,"If the battery is switched off in flight, the.",B,captain's instruments will be powered from the standby bus.,battery is disconnected from bus.,generator voltage falls to zero.
11,1210,To flash a generator field the.,C,generator is on line and producing a voltage less than the flashing voltage.,generator rotates but is not on line.,generator must be stationary.
11,1211,Voltage is controlled by.,B,the constant speed drive.,the voltage regulator.,the swashplate.
11,1212,The ground interlock pins are numbered.,C,A and B.,C and N.,E and F.
11,1213,Distilled water should be added to a ni-cad battery.,A,only in the battery workshop.,at any time.,when fully charged.
11,1214,Overflowing electrolyte in a ni-cad battery indicates.,B,not enough charging current.,excessive charging current.,low electrolyte temperature.
11,1215,"During a normal engine shutdown, generator tripping is initiated by.",A,undervoltage.,underfrequency.,overcurrent.
11,1216,What would you use to neutralise nicad battery spillage?.,A,Boric acid.,Distilled water.,Bicarbonate of soda.
11,1217,"Before operating generators in parallel, their voltages should be matched to prevent.",B,large circulating currents developing.,overloading the generator drive and shearing of splines.,voltage spikes of sufficient magnitude to trigger GCU overvoltage circuits.
11,1218,Consumer loads are connected to a busbar.,B,in series so when loads are shed voltage is reduced.,in parallel so when loads are shed current is reduced.,in series so when loads are shed current is reduced.
11,1219,A current transformer connected on the neutral star point of a generator is for.,B,overload protection.,differential current protection.,negative sequence protection.
11,1220,Differential protection as applied to AC generation systems compares.,A,generator current to busbar current.,generator voltage to busbar voltage.,ambient pressure to cabin pressure.
11,1221,"In an AC generation system, the frequency and phase rotation.",A,must be synchronised prior to paralleling.,is of no consequence after paralleling.,must be out of phase prior to paralleling.
11,1222,Diodes are placed across a contactor to.,C,ensure smooth contactor operation.,prevent contact bounce.,speed up operation by reducing back EMF.
11,1223,Placing the battery master switch to off during flight will.,A,isolate the battery from the main busbar.,shut down the APU.,disconnect all power to the main busbar.
11,1224,"Whilst operating paralleled AC constant frequency generators, it is important to maintain generator outputs at the same voltage.",A,to prevent a circulating current of considerable magnitude developing between two or more generators.,to prevent CSD shock loading.,to prevent a circulating current developing between two or more TRUs.
11,1225,A voltage regulator installed in series with a generator field.,B,uses a voltage coil in series with generator output.,uses a voltage coil in parallel with generator output.,uses a current coil in parallel with generator output.
11,1226,CSD warning lights on the flight deck normally indicate.,C,"high oil pressure, low oil temperaturelow oil pressure, high oil temperature.","low oil pressure, low oil temperature.","low oil pressure, high oil temperature."
11,1227,The output frequency of a hydraulically driven standby generator is controlled by.,A,an hydraulically actuated swash plate.,a CSD.,an IDG.
11,1228,An AC generator used with a CSD.,A,needs a voltage controller to maintain voltage with increasing load.,does not need a voltage controller because current is kept constant.,does not need a voltage controller because voltage is kept constant.
11,1229,Power to a GCU is supplied.,A,initially by a 'field tickling' supply and then PMG output.,by the battery bus or rectified generator output.,by the generator output only.
11,1230,Trip signals for a GCR are.,B,overfrequency and undervoltage.,differential protection and undervoltage.,underfrequency and overcurrent.
11,1231,Abnormal CSD operation is monitored on the flight deck by observing indications of.,B,low oil quantity / low oil temperature.,high oil temperature / low oil pressure.,High oil temperature / low oil quantity.
11,1232,Wires in hot temperature areas should be bound with.,A,Teflon.,Nomex.,PVC.
11,1233,A heat gun should be operated at.,C,100°C above the specified.,100°C below the specified.,the specified temperature.
11,1234,High voltages on a generator in a parallel system should be prevented because.,A,it will trip the GCR.,it will damage the drive shaft.,it will cause high circulating current in the bus / other generators.
11,1235,Over-voltage condition trips the generator. The time taken to trip the GCU depends on.,A,amplitude of voltage.,closing of fuel and hydraulic valves.,time delay circuit.
11,1236,Speed of an HMG is controlled by a.,B,CSD unit.,swashplate.,ID unit.
11,1237,A permanent magnet should have.,B,"low retentivity, low coercivity.","high retentivity, low coercivity.","low retentivity, high coercivity."
11,1238,What will happen if the aircraft battery becomes overheated?.,B,The power supply to the battery charger will be interrupted.,The battery charger will switch to trickle charge mode.,The hot battery bus will be disconnected from the battery.
11,1239,"When the temperature increases in a lead acid battery, the SG will.",A,decrease.,increase.,remain the same.
11,1240,"On testing a generator it is found to require adjusting, where would you adjust it?.",C,In the cockpit on the flight engineers panel.,On the GCU.,By means of a remote trimmer.
11,1241,Control of hydraulically powered emergency electrical generator frequency is.,B,by CSU.,by angle of swash plate.,by IDG.
11,1242,When a ni-cad battery is fully charged.,A,the electrolyte level is higher level than normal.,the electrolyte level is lower than normal.,the electrolyte level stays the same.
11,1243,Electrical load on aircraft is controlled by.,A,a BPCU.,an IRS.,a GCU.
11,1244,A 4:1 step-up transformer receives 120VAC in its primary and has 1600 Ohms resistance in its secondary. What is the current drawn from the source?.,A,1.2 A.,0.3 A.,"0,125"
11,1245,"After engine start using a Ni-Cad battery, the pilot observes on the battery charger indicator, an initial high current draw followed by a rapid decrease in current.",C,there is a problem with the charging circuit and he must shut-down the engines.,the battery is faulty.,no cause for concern.
11,1246,Topping up a Ni-Cad battery in situ.,A,is not allowed.,is only allowed in the shop.,is permitted.
11,1247,"In a lead-acid battery after numerous checks, one cell has low reading.",B,It needs topping up.,It must be replaced.,It is defective.
11,1248,A short range passenger aircraft has complete electrical failure. What time duration would the battery be expected to power essential equipment?.,A,30 minutes.,Forever.,60 minutes.
11,1249,An external power plug has two short pins. These are used for.,B,ground handling bus.,the interlock circuit.,a guide for correct alignment of the plug in the socket.
11,1250,The purpose of a synchronising bus bar is.,A,to allow monitoring and trimming from the flight deck.,to enable two propeller systems to be synchronised.,to monitor total current load.
11,1251,To confirm the state of charge of a ni-cad battery.,A,measure the discharge time.,"subject the battery to load, check voltage and check the SG of each cell.",subject the battery to load and check the voltage.
11,1252,Circulating currents are associated with.,B,AC and DC generators in parallel.,AC generators in parallel.,DC generators in parallel.
11,1253,Generator brush bedding.,C,should only be done if 50% of the width and 80% of the length is already being done.,should not be done on the aircraft.,can be done on the aircraft.
11,1254,What is the amperage at point '' to the nearest amp?.,B,100 Amps.,101 Amps.,102 Amps.
11,1255,Pitot tubes are heated by.,C,DC.,AC.,AC or DC.
11,1256,Paralleling is used for.,A,AC and DC electrical generators.,DC electrical generators only.,AC electrical generators only.
11,1257,Battery charging procedures can be found in ATA.,B,Chapter 24 Section 21.,Chapter 24 Section 31.,Chapter 31 Section 21.
11,1258,"In a carbon pile regulator, the resistive element is.",A,in series with the field and changes resistance with surface area contact.,in parallel with the field and changes resistance with changing length.,in series with the field and changes resistance with changing length.
11,1259,Maximum battery temperature on charging before protection circuit starts is.,B,144 degrees C.,144 degrees F.,71 degrees F.
11,1260,"If an aircraft has no battery charger, the battery is charged by.",C,constant current until a predetermined limit when it automatically switches to constant voltage.,constant current.,constant voltage.
11,1261,The output of a carbon pile regulator with no variation of loading is.,A,stationary.,pulse width modulating.,fluctuating.
11,1262,"In a transistor voltage regulator, the voltage output is controlled by.",A,zeners and transistors.,diodes and transformers.,transformers and transistors.
11,1263,A paralleled relay for a DC system is energised and connected by.,C,voltage coil.,current coil.,voltage and current coil.
11,1264,Increasing the real load primarily.,C,increases output voltage and increases frequency.,decreases output voltage.,decreases frequency.
11,1265,Inductive reactive load causes.,A,no effect on torque but produces extra heat dissipated.,increase in torque only.,increase in torque and increase in heat dissipated.
11,1266,The power factor of an AC generator identifies the proportion of.,B,apparent power from the generator that does work.,real power from the generator that does work.,reactive power from the generator that does work.
11,1267,Differential protection in an AC system protects against.,B,"line-line, line-line-line, line-earth faults.",short circuits.,a reverse current flowing from the battery.
11,1268,"When resetting the CSD on the ground, the engine should be.",C,rotating at Nsync.,rotating at idle.,stationary.
11,1269,One of the main purposes of a CSD is to.,B,prevent engine overload.,enable generators to be paralleled.,maintain constant load on the generator.
