Module,QuestionNo,Question,Correct Answer,Option A,Option B,Option C
17,121,What is the main reason for synchrophasing system?,B,To eliminate noise and vibration,To increase passenger comfort,To eliminate phase difference between twin engine propellers
17,122,How does a synchrophasing system find out which phase angle is the best?,A,"noise measurement in the cabin is done for different blade angles, phase angles, rpms etc. during aircraft development phase and all the values are entered into the computer.",noise measurement in the cabin is done by using noise sensors during actual flight and a visual warning is illuminates in the lowest noise value.,noise measurement in the cabin is done by using vibration sensors during actual flight and a visual warning is illuminates in the lowest noise value
17,123,Find the correct statement.,C,"On twin engines, first synchrophasing then snchronising should be done","On twin engines, when synchrophasing system is available, there is no need for sychronising system","On twin engines, first snchronising then synchrophasing should be done"
17,124,Synchronising system can be turned off during…….,C,take-off,"take-off, landing","take-off, landing, single engine operation"
17,125,"If the engines are manually sychronised to within ……… and the control knob is set to ON, engines will be synchronised to a speed difference of zero.",A,± 2 % of rpm,± 5 % of rpm,± 10 % of rpm
17,126,There are two types of ice protection system used for propeller. These are ……….,A,chemical anti-icing and electrothermal de-icing,pneumatic anti-icing and electrothermal de-icing,pneumatic anti-icing and hydraulic de-icing
17,127,What is the difference between propeller anti-icing and de-icing systems?,B,propeller anti-icing system removes ice after build-up and de-icing system eliminates ice build-up,propeller anti-icing system eliminates ice build-up and de-icing system removes ice after build-up,both propeller anti-icing and de-icing systems eliminates ice buld-up
17,128,Chemical anti - icing uses ……. and amount of it is adjusted by ……….,C,"freon, electric motor","isopropyl alcohol, hydraulic motor","isopropyl alcohol, electric motor"
17,129,How is the anti-icing chemical forwarded into propeller?,A,by slinger ring,by brush block,by slip ring
17,130,How many electrical circuit is installed in the electrothermal de-icing system in propellers?,B,1,2,3
17,131,Electrical power for the de-icer boots is controlled by the timers. How is it transmitted to the de-icer mats?,A,via slip ring,via reostat,via MOV module
17,132,The controls for prop de-icing system are located at the ice protection panel. They are labeled with ……..,C,"BELOW - 10˚C, OFF, ABOVE 0˚C","BELOW 0˚C, OFF, ABOVE - 10˚C","BELOW - 10˚C, OFF, ABOVE - 10˚C"
17,133,What is a Metal Oxide Varistor used for?,A,to protect electrical power supply against lightning strike,to protect propeller blades against corrosion,to vary electrical power during de-icing operation
17,134,"To avoid any damage to a carbon fibre propeller blades by overheating, timer prevents any output to the de-icer mats if the prop rpm drops below ………",B,500 rpm ± 25 rpm,675 rpm ± 25 rpm,1000 rpm ± 50 rpm
17,135,De-icer mats are heated alternately depending on the knob selection. Find the correct statement,C,slow cycle at low air temperature(Above -10C) only,fast cycle at high air temperature (Below -10C) only,slow cycle at low air temperature( Below -10C) and fast cycle at high air temperature (Above -10C)
17,136,"To avoid any damage to a carbon fibre propeller blades by overheating, the mode Below – 10C is disabled at the temperatures of ……..",A,+ 5 C and above,+ 10 C and above,+ 15 C and above
17,137,"If anti-icing system has a resistance increase, what is the reason for that?",C,due to the load increase,due to the voltage control system failure,due to the one open circuit in the system
17,138,Find the preventive maintenance action,C,changes in the blade design,installation of a part which is not approved,replacement of safety wiring
17,139,Which is not defined as major alteration?,C,changes in the hub design,installation of a governer system,replacement of cutter keys
17,140,Defects on the leading edge of an aluminium blade may be dressed out by using round files. What is the most important process during a repair?,B,Radius should not be too large,Maximum thickness should not be destroyed,Contour should not be too blunt
17,141,Which one is the correct statement?,A,Max. allowable size of a repaired edge 3.2 mm in depth and 38 mm in length,Max. allowable size of a repaired edge 1.6 mm in depth and 25 mm in length,Max. allowable size of a repaired edge 0.8 mm in depth and 12 mm in length
17,142,Which one is the correct statement?,A,"Max. allowable size of a repaired surface 1.6 mm in depth, 9.5 mm in wide and 25.4 mm in length","Max. allowable size of a repaired surface 1.6 mm in depth, 18 mm in wide and 36 mm in length","Max. allowable size of a repaired surface 3.2 mm in depth, 9.5 mm in wide and 25.4 mm in length"
17,143,What action should be taken if there are cracks at shank?,C,should be repaired in line,should be repaired in maintenance station,should be replaced
17,144,"If a blade has been bent, the angle of the bend are to be measured by a ………..?",A,protractor,micrometer,scale
17,145,What does ‘Z’ stand for regarding propeller repair?,C,Degree of bend is below 50% limit and corrected once before,Degree of bend is below 50% limit and corrected twice before,Degree of the bend exceeds 50% of the allowable limit and no more correction is allowed
17,146,What does ‘S2’ stand for regarding propeller repair?,B,Degree of bend is less than 50% limit and corrected once before,Degree of bend is less than 50% limit and corrected twice before,Degree of the bend exceeds 50% of the allowable limit and no more correction is allowed
17,147,Propeller vibration level is determined as IPS. What does IPS stand for?,A,Inch Per Second,Indicated Power Stroke,Incremental Pulse System
17,148,"When propeller vibration is the reason for excessive powerplant vibration, nornal causes are:",C,blade imbalance only,"blades not tracking, blade imbalance",all above
17,149,"Which statement is correct, regarding blade tracking?",C,both metal propellers and wooden propellers can be out of track not more than 1.6 mm,both metal propellers and wooden propellers can be out of track not more than 3.2 mm,metal propellers can be out of track not more than 1.6 mm while wooden propellers not more than 3.2mm
17,150,"If propeller vibration occurs, we should do first;",B,blade balance,blades tracking,blade angle setting
17,151,"If the propeller is out of tracking limit, adjustment should be done ………..",A,by either A or B,by bolt torque only,by the use of shims only
17,152,What is the most popular static balancing system?,A,knife - edge method,suspension method,dynamic method
17,153,If a metal propeller has been subjected to salt water then extra cleaning and protection ………,C,should be done by soap and wax,is not necessary,should be done by water and oil
17,154,"If a repair of a propeller blade made from composite material is needed, it should be done by …",C,line tecnician,maintenance station,composite repair station
17,155,Propeller should be stored in transport cases and stored in a closed room. Relative humidity of air in that room may be of ……..,B,30 -45 %,45 – 70%,60 – 75%
17,156,Propeller should be stored in transport cases and stored in a closed room. Air temperature must be kept at range of ……..,C,+ 0 to + 20 C˚,+ 5 to + 30 C˚,+ 10 to + 40 C˚
17,157,"Propeller preservation when storage is carried out on the aircraft for a period of 30 days, includes …….",A,Place the protective covers only,Autowax the blades only,"First, place the protective covers and then autowax the blades"
17,158,"Propeller preservation when storage is carried out on the aircraft upto three months, includes …….",C,Place the protective covers only,Autowax the blades only,"First, place the protective covers and then autowax the blades"
17,159,Propeller preservation when storage is carried out on the aircraft is done for periods of ………,A,"30 days, 3 months, 12 months","30 days, 3 months","30 days, 3 months, 6 months"
17,160,Storage of wooden propellers are very important due to imbalance danger. How should the wooden props be stored in storage room?,B,in vertical position with a shank upside,in horizontal position,in vertical position with a tip upside
17,161,During storage of propellers a Storage Form should be filled out. When the storage time is over ………………,A,New Storage Form is needed,Current form is used,B2 licence is needed to initiate new form
17,162,What type of protection is needed for metal blades during storage?,C,just store in the heated closed area,preserve with a protective material and store in the closed area,preserve with a protective material and store it in wooden case
