Module,QuestionNo,Question,Correct Answer,Option A,Option B,Option C
8,26," If you steepen the angle of a banked turn without increasing airspeed or angle of attack, what will the aircraft do?
",B,It will remain at the same height,It will sideslip with attendant loss of height,It will stall
8,27,An aircraft wing tends to stall first at,C,the tip due to a higher ratio thickness/chord,the tip due to a lower ratio thickness/chord,the root due to a higher ratio thickness/chord
8,28,Dihedral wings combat instability in,C, pitch, yaw,sideslip
8,29,"To stop aircraft decreasing in height during a sideslip, the pilot can",A,advance the throttle,pull back on the control column,adjust the rudder position
8,30,"What control surface movements will make an aircraft fitted with ruddervators yaw to the left?
",A,"Left ruddervator lowered, right ruddervator raised","Right ruddervator lowered, left ruddervator raised", Both ruddervators raised
8,31,". When a leading edge slat opens, there is a gap between the slat and the wing. This is",B,to allow it to retract back into the wing,to allow air through to re-energize the boundary layer on top of the wing,to keep the area of the wing the same
8,32,Which of the following is true?,B,Lift acts at right angles to the wing chord line and weight acts vertically down,Lift acts at right angles to the relative airflow and weight acts vertically down,"Lift acts at right angles to the relative air flow and weight acts at right angles to theaircraft centre line_x000D_
8	NULL	33	 If the wing tips stall before the root on a swept wing aircraft, the aircraft will						x	x	x	x	x	x			B	roll	pitch nose up	pitch nose down_x000D_
8	NULL	34	Lift on a delta wing aircraft						x	x	x	x	x	x			A	increases with an increased angle of incidence (angle of attack)	decreases with an increase in angle of incidence (angle of attack)	does not change with a change in angle of incidence (angle of attack)_x000D_
8	NULL	35	On a straight wing aircraft, stall commences at the						x	x	x	x	x	x			A	root on a high thickness ratio wing	tip on a high thickness ratio wing	tip on a low thickness ratio wing_x000D_
8	NULL	36	On a high wing aircraft in a turn						x	x	x	x	x	x			B	the up-going wing loses lift causing a de-stabilizing effect	the down-going wing gains lift causing a stabilizing effect	the down-going wing loses lift causing a de-stabilizing effect_x000D_
8	NULL	37	For the same angle of attack, the lift on a delta wing						x	x	x	x	x	x			B	is greater than the lift on a high aspect ratio wing	is lower than the lift on a high aspect ratio wing	is the same as the lift on a high aspect ratio wing_x000D_
8	NULL	38	Standard sea level temperature is	x	x	x	x	x							x		B	0 degrees Celsius	15 degrees Celsius	20 degrees Celsius_x000D_
8	NULL	39	As altitude increases, pressure	x	x	x	x	x							x		C	decreases at constant rate	increases exponentially	decreases exponentially_x000D_
8	NULL	40	The thrust-drag couple overcomes the lift-weight couple. What direction of force is required to be produced by the tail of the aircraft to maintain straight and level flight?
						x	x	x	x	x	x			A	 Upwards	 Downwards	Sideways_x000D_
8	NULL	41	Lapse rate usually refers to	x	x	x	x	x							x		C	Pressure	Density	 Temperature_x000D_
8	NULL	42	During a turn, the stalling angle	x	x	x	x	x							x		C	 increases	decreases	remains the same_x000D_
8	NULL	43	The vertical fin of a single engined aircraft is	x	x	x	x	x							x		A	parallel with both the longitudinal axis and vertical axis	parallel with the longitudinal axis but not the vertical axis	parallel with the vertical axis but not the longitudinal axis_x000D_
8	NULL	44	Aircraft flying in the transonic range most often utilize	x	x	x	x	x							x		A	sweptback wings	advanced supercritical airfoils	high wings_x000D_
8	NULL	45	Which type of flap changes the area of the wing?	x	x	x	x	x							x		A	Fowler	Split	Slotted_x000D_
8	NULL	46	Forward swept wings tend to stall at the root first so the aircraft retains lateral control, so why are they never used on passenger aircraft?
						x	x	x	x	x	x			C	Because the wing tips wash in at high wing loads	Because the wing tips wash out at high wing loads	Because at high loads their angle of incidence increases and the loads imposed on the  wing can increase until they destroy it"
8,47,What happens to air flowing at the speed of sound when it enters a converging duct?,A,"Velocity decreases, pressure and density increase","Velocity increases, pressure and density decreases","Velocity, pressure and density increase"
8,48,As the angle of attack of an airfoil increases the centre of pressure,A,moves forward,moves aft,remains stationary
8,49,"An aircraft, which is longitudinally stable, will tend to return to level flight after a movement about which axis?
",A, Pitch,Roll,Yaw
8,50,Vapour trails from the wingtips of an aircraft in flight are caused by,A,low pressure above the wing and high pressure below the wing causing vortices,high pressure above the wing and low pressure below the wing causing vortices,low pressure above the wing and high pressure below the wing causing a temperature
8,51,Vortex generators on the wing are most effective at,C,high speed,low speed,high angles of attack
8,52,The chord line of a wing is a line that runs from,A,the centre of the leading edge of the wing to the trailing edge,half way between the upper and lower surface of the wing,one wing tip to the other wing tip
8,53, The angle of incidence of a wing is an angle formed by lines,A,parallel to the chord line and longitudinal axis,parallel to the chord line and the lateral axis,parallel to the chord line and the vertical axis
8,54,The centre of pressure of an aerofoil is located,A,30 - 40% of the chord line back from the leading edge,30 - 40% of the chord line forward of the leading edge,50% of the chord line back from the leading edge
8,55,Compressibility effect is,C,drag associated with the form of an aircraft,drag associated with the friction of the air over the surface of the aircraft,the increase in total drag of an airfoil in transonic flight due to the formation of shock
8,56,Lateral control of an aircraft at high angle of attack can be maximized by using,B,fences,vortex generators,wing slots
8,57,Stall strips are always,B,made of metal,on the leading edge of a wing,fitted forward of the ailerons
8,58,Stall strips,A,cause the wing root to stall,cause the wing tip to stall,cause the wings to stall symmetrically
8,59," Due to the interference of the airflow on a high wing aircraft between the fuselage and thewings, the lateral stability of the aircraft in a gusty wind situation will cause
",B,the upper wing to increase its lift,the upper wing to decrease its lift,the lower wing to decrease its lift
8,60,Slats,A,reduce the stall speed,reduce the tendency of the aircraft to Yaw, decrease the aerofoil drag at high speeds
8,61,A high aspect ratio wing will give,C,high profile and low induced drag,low profile and high induced drag,low profile and low induced drag
8,62,Aerofoil efficiency is defined by,A,lift over drag,drag over lift,lift over weight
8,63,"An aircraft banks into a turn. No change is made to the airspeed or angle of attack. What
will happen?
",A,The aircraft enters a side slip and begins to lose altitude,The aircraft turns with no loss of height,The aircraft yaws and slows down
8,64,The relationship between induced drag and airspeed is,B,directly proportional to the square of the speed,inversely proportional to the square of the speed,directly proportional to speed
8,65,What is the definition of Angle of Incidence?,C,The angle the underside of the mainplane or tailplane makes with the horizontal,The angle the underside of the mainplane or tailplane makes with the longitudinal datum line,The angle the chord of the mainplane or tailplane makes with the horizontal
8,66,What is Boundary Layer?,C,Separated layer of air forming a boundary at the leading edge,Turbulent air moving from the leading edge to trailing edge,"Sluggish low energy air that sticks to the wing surface and gradually gets faster until it joins the free stream flow of air_x000D_
8	NULL	67	The normal axis of an aircraft passes through						x	x	x	x	x	x			A	the centre of gravity	a point at the center of the wings	at the centre of pressure_x000D_
8	NULL	68	on a high winged aircraft, what effect will the fuselage have on the up-going wing?						x	x	x	x	x	x			A	The up-going wing will have a decrease in angle of attack and therefore a decrease in"
8,69,"What is the collective term for the fin and rudder and other surfaces aft of the centre of gravity that helps directional stability?
",A,Effective keel surface, Empennage,Fuselage surfaces
8,70,"Temperature above 36,000 feet will",B,decrease exponentially,remain constant,increase exponentially
8,71,A decrease in incidence toward the wing tip may be provided to,C,prevent adverse yaw in a turn,prevent spanwise flow in maneuvers,retain lateral control effectiveness at high angles of attack
8,72,The angle of attack which gives the best L/D ratio,B,decreases with a decrease in density,in unaffected by density changes,increases with a decrease in density
8,73,"for a given aerofoil production lift, where P = pressure and V = velocity:",C,"P1 is greater than P2, and V1 is greater than V2",P1 is less than P2 and V1 is greater than V2,"P1 is greater than P2, and V1 is less than V2"
8,74,Low wing loading,C,"increases stalling speed, landing speed and landing run","increases lift, stalling speed and maneuverability","decreases stalling speed, landing speed and landing run"
8,75,"Due to the change in downwash on an untapered wing (i.e. one of constant chord length) it
will
",B,not provide any damping effect when rolling,tend to stall first at the root,not suffer adverse yaw effects when turning
8,76, True stalling speed of an aircraft increases with altitude,B,because reduced temperature causes compressibility effect,because air density is reduced,because humidity is increased and this increases drag
8,77," As a general rule, if the aerodynamic angle of incidence (angle of attack) of an aerofoil is slightly increased, the centre of pressure will
",B,never move,move forward towards the leading edge,move towards the tip
8,78,"The ""wing setting angle"" is commonly known as",A,angle of incidence,angle of attack,angle of dihedral
8,79,"on a very humid day, an aircraft taking off would require",B,a shorter take off run,a longer take off run,humidity does not affect the take off run
8,80,"an aircraft is flying at 350 MPH, into a head wind of 75 MPH, what will its ground speed be?",B,175 mph,275 mph,200 mph
8,81,When does the angle of incidence change?,C,When the aircraft attitude changes,When the aircraft is ascending or descending,It never changes
8,82,"as the angle of attack decreases, what happens to the centre of pressure?",B,It moves forward,It moves rearwards,Centre of pressure is not affected by angle of attack decrease
8,83,A decrease in pressure over the upper surface of a wing or aerofoil is responsible for,A, approximately 2/3 (two thirds) of the lift obtained,approximately 1/3 (one third) of the lift obtained,approximately 1/2 (one half) of the lift obtained
8,84,Which of the four forces act on an aircraft?,A,"Lift, gravity, thrust and drag","Weight, gravity, thrust and drag","Lift, weight, gravity and drag"
8,85,Which of the following types of drag increases as the aircraft gains altitude?,B,Parasite drag,Induced drag,Interference drag
8,86,"Correcting for a disturbance which has caused a rolling motion about the longitudinal axis would re-establish which of the following?
",A,Lateral stability,Directional stability,Longitudinal stability
8,87,"the layer of air over the surface of an aerofoil which is slower moving, in relation to the
rest of the airflow, is known as
",B,camber layer,boundary layer,none of the above
8,88,What is a controlling factor of turbulence and skin friction?,C,Aspect ratio,Fineness ratio,Counter sunk rivets used on skin exterior
8,89,Changes in aircraft weight,B,will not affect total drag since it is dependant only upon speed,cause corresponding changes in total drag due to the associated lift change,will only affect total drag if the lift is kept constant
8,90,The aircraft stalling speed will,A,increase with an increase in weight,be unaffected by aircraft weight changes since it is dependant upon the angle of attack,only change if the MTMA were changed
8,91,In a bank and turn,C,extra lift is not required,extra lift is not required if thrust is increased,extra lift is required
8,92," To maintain straight and level flight on the aeroplane shown, with a decrease in tail-plane
download the mainplane lift would have to
",B,remain constant,decrease, increase
8,93,"To achieve the maximum distance in a glide, the recommended air speed is",C,as close to the stall as practical,as high as possible with VNE,the speed where the L/D ratio is maximum
8,94, If the C of G is aft of the Centre of Pressure,A,changes in lift produce a pitching moment which acts to increase the change in lift,"when the aircraft sideslips, the C of G causes the nose to turn into the sideslip thus applying a restoring moment	NULL_x000D_
8	NULL	95	Proposing is an oscillatory motion in the						x	x	x	x	x	x			A	pitch plane	roll plane	yaw plane_x000D_
8	NULL	96	Directional stability is maintained						x	x	x	x	x	x			C	by the mainplanes, and controlled by the ailerons	by the tailplane, and controlled by the elevators	by the keel surface and fin, and controlled by the rudder_x000D_
8	NULL	97	Due to the interference effects of the fuselage, when a high wing aeroplane sideslips						x	x	x	x	x	x			B	the accompanying rolling due to keel surface area is destabilizing	the accompanying lift changes on the wings produces a stabilizing effect	the accompanying rolling due to the fin is destabilizing_x000D_
8	NULL	98	The power required in a horizontal turn						x	x	x	x	x	x			A	is greater than that for level flight at the same airspeed	must be the same as that for level flight at the same airspeed	is less than that for level flight at the same airspeed_x000D_
8	NULL	99	A wing mounted stall sensing device is located						x	x	x	x	x	x			A	usually on the under surface	always at the wing tip	always on the top surface_x000D_
8	NULL	100	For an aircraft in a glide						x	x	x	x	x	x			B	thrust, drag, lift and weight act on the aircraft	weight, lift and drag act on the aircraft	weight and drag only act on the aircraft_x000D_
8	NULL	101	The upper part of the wing in comparison to the lower						x	x	x	x	x	x			A	develops more lift	develops the same lift	develops less lift_x000D_
8	NULL	102	What effect would a forward CG have on an aircraft on landing?						x	x	x	x	x	x			A	Increase stalling speed	No effect on landing	Reduce stalling speed_x000D_
8	NULL	103	QNH refers to						x	x	x	x	x	x			C	Quite near horizon	setting the altimeter to zero	setting the mean sea level atmospheric pressure so an altimeter reads the aerodrome altitude above mean sea level",71
8,104,QNE refers to,C,Setting an altimeter to read aerodrome altitude above sea level,Quite new equipment,"setting the mean sea level atmospheric pressure in accordance with ICAO standard atmosphere i.e. 1013 millibars_x000D_
8	NULL	105	An aspect ratio of 8 would mean						x	x	x	x	x	x			A	span 64, mean chord 8	mean chord 64 , span 8	span squared 64 ,chord 8_x000D_
8	NULL	106	If an aircraft in level flight loses engine power it will						x	x	x	x	x	x			B	pitch nose up	pitch nose down	not change pitch without drag increasing_x000D_
8	NULL	107	QFE is						x	x	x	x	x	x			B	sea level pressure	airfield pressure	difference between sea level and airfield pressure_x000D_
8	NULL	108	The lift /drag ratio at stall						x	x	x	x	x	x			B	increases	 decreases	is unchanged_x000D_
8	NULL	109	 On a straight unswept wing, stall occurs at						x	x	x	x	x	x			A	the thick portion at the wing root	the thick portion at the wing tip	the thin portion at the wing tip_x000D_
8	NULL	110	During a climb from a dive						x	x	x	x	x	x			B	the thrust required is greater than required for level flight	the thrust required is lower than for level flight	_x000D_
8	NULL	111	When power is off, the aircraft will pitch						x	x	x	x	x	x			A	nose down	nose up	trim level_x000D_
8	NULL	112	Angle of attack on a down going wing in a roll						x	x	x	x	x	x			A	increases	decreases	 unaffected_x000D_
8	NULL	113	For any given speed, a decrease in aircraft weight, the induced drag will						x	x	x	x	x	x			B	increase	decrease	remain the same_x000D_
8	NULL	114	The amount of lift generated by a wing is						x	x	x	x	x	x			A	greatest at the root	greatest at the tip	constant along the span_x000D_
8	NULL	115	Induced Drag is	x	x	x	x	x							x		C	 greatest towards the wing root and downwash is greatest at the tip	greatest towards the wing tip and downwash is greatest towards the root	greatest towards the tip and downwash decreases from tip to root_x000D_
8	NULL	117	With an increase in aircraft weight	x	x	x	x	x							x		C	Vmd will be at the same speed	Vmd will be at a lower speed	Vmd will be at a higher speed_x000D_
8	NULL	118	For a given IAS an increase in altitude will result in	x	x	x	x	x							x		B	no change in the value of induced drag	an increase in induced drag	an increase in profile drag_x000D_
8	NULL	119	As the angle of attack of a wing is increased in level flight	x	x	x	x	x							x		B	the Cof G moves aft and the Cof P forward	the Cof P and transition point move forward	the Cof P moves forward and the stagnation point aft over the upper surface_x000D_
8	NULL	120	Stall inducers may be fitted to a wing						x	x	x	x	x	x			C	at the tip to cause the root to stall first	at the root to cause the tip to stall first	at the root to cause the root to stall first_x000D_
8	NULL	121	With increasing altitude pressure decreases and	x	x	x	x	x							x		B	temperature decreases at the same rate as pressure reduces	temperature decreases but at a lower rate than pressure reduces	temperature remains constant to 8000 ft_x000D_
8	NULL	122	The Centre of Pressure is	x	x	x	x	x							x		A	the point on the chord line at which the resultant lift force may be said to act	the point of maximum pressure on the under surface of the wing	the centre of gravity of the wing_x000D_
8	NULL	123	If the angle of attack is increased the Centre of Pressure will	x	x	x	x	x							x		A	move forward	move rearward	remain stationary_x000D_
8	NULL	124	The optimum angle of attack of an aerofoil is the angle at which						x	x	x	x	x	x			C	the aerofoil produces maximum lift	the aerofoil produces zero lift	the highest lift/drag ratio is produced_x000D_
8	NULL	125	A high aspect ratio wing has a						x	x	x	x	x	x			B	increased induced drag	decreased induced drag	decreased skin friction drag_x000D_
8	NULL	126	Minimum total drag of an aircraft occurs						x	x	x	x	x	x			B	at the stalling speed	when profile drag equals induced drag	when induced drag is least_x000D_
8	NULL	127	If the weight of an aircraft is increased, the induced drag at a given speed						x	x	x	x	x	x			A	will increase	will decrease	will remain the same_x000D_
8	NULL	128	The transition point on a wing is the point where						x	x	x	x	x	x			B	the flow separates from the wing surface	 the boundary layer flow changes from laminar to turbulent	the flow divides to pass above and below the wing_x000D_
8	NULL	129	The boundary layer of a body in a moving airstream is						x	x	x	x	x	x			C	a thin layer of air over the surface where the air is stationary	a layer of separated flow where the air is turbulent	a layer of air over the surface where the airspeed is changing from free stream speed to zero speed"
8,130,A laminar boundary layer will produce,B,more skin friction drag than a turbulent one,less skin friction drag than a turbulent one,the same skin friction drag as a turbulent one
8,131,Longitudinal stability is given by,C,the fin,the wing dihedral,the horizontal tailplane
8,132,Lateral stability is given by,B,the aileron,the wing dihedral,the horizontal tailplane
8,133,Stability about the lateral axis is given by,B,wing dihedral,the horizontal tailplane,the ailerons
8,134,Sweepback of the wings will,A,increase lateral stability,decrease lateral stability,not affect the lateral stability
8,135,Dutch Roll is,A,a combined rolling and yawing motion,a type of slow roll,primarily a pitching instability
8,136,A high wing position gives,A,more lateral stability than a low wing,less lateral stability than a low wing,the same lateral stability as a low wing
8,137,On an aircraft in an unpowered steady speed descent,C,the lift equals the weight,the weight equals the drag,the weight equals the resultant of the lift and drag
8,138,When an aircraft rolls to enter a turn and power is not increased,C,the lift equals the weight,the lift is greater than the weight,the lift is less than the weight
8,139,The boundary layer is,B,thickest at the leading edge,thickest at the trailing edge,constant thickness from leading to trailing edges
8,140,The amount of thrust produced by a jet engine or a propeller can be calculated using,B,Newton’s 1st law,Newton’s 2nd law,Newton’s 3rd law
8,141,An engine which produces an efflux of high speed will be,B,more efficient,less efficient,speed of efflux has no affect on the engine efficiency
8,142,"When an aircraft with a C of G forward of the C of P rolls, the nose of the aircraft will",C,stay level, rise,drop
8,143,Directional stability may be increased with,C,pitch dampers,horn balance,yaw dampers
8,144,Lateral stability may be increased with,A,increased lateral dihedral,increased lateral anhedral,increased longitudinal dihedral
8,145,Longitudinal stability is increased if the,C,CP moves forward of the CG,Thrust acts on a line below the total drag,CG is forward of the CP
8,146,Wing loading is calculated by weight,A,divided by gross wing area,divided by lift,multiplied by gross wing area
8,147,Induced drag is,A,inversely proportional to the square of speed,proportional to speed,nothing to do with speed
8,148,"In a bank, the weight is",A,increased,decreased,the same
8,149,L/D ratio is,B,higher at supersonic cruise speed,higher at sub sonic speed,the same
8,150,The power required at low altitude for a given IAS is,C,the same as at high altitude, higher, lower
8,151, If the stall speed is 75 knots what is the same stall speed in mph,B,75 x 0.87,75 / 0.87,75 / 0.87 x relative density
8,152,As the angle of attack increases the stagnation point,B,moves towards the upper surface,moves towards the lower surface,does not move
8,153,The term pitch-up is due to,C,compressibility effect,ground effect,longitudinal instability
8,154,"In a steady climb at a steady IAS, the TAS is",A,more than IAS,less than IAS,the same
8,155,An untapered wing will,C,have no yaw effect in banking,have no change in induced drag in the bank,stall at the root first
8,156,"With the ailerons away from the neutral, induced drag is",C,unchanged but profile drag is higher,higher on the lower wing plus profile drag increases,higher on the upper wing plus profile drag increases
8,157,The lift drag ratio is,B,higher at mach numbers above supersonic,higher at sub sonic mach numbers,the same
8,158,The force opposing thrust is,A,drag,lift, Weight
8,159,Directional stability is about the,A,normal axis,longitudinal axis,lateral axis
8,160,Lateral stability is about the,A,longitudinal axis,normal axis,vertical axis
8,161,All the lift can be said to act through the,A,centre of pressure,centre of gravity,normal axis
8,162,Longitudinal stability is provided by the,A,horizontal stabilizer,vertical stabilizer,mainplane
8,163,The concept of thrust is explained by,B,Newton’s 1st law,Newton’s 3rd law,Bernoulli’s theorem
8,164,The camber of an aerofoil section is,A,the curvature of the median line of the aerofoil,the angle of incidence towards the tip of a wing,the angle which the aerofoil makes with the relative airflow
8,165,If the aircraft turns and side-slips,B,the sweepback of the wing will correct the sideslip,the dihedral of the wing will correct the sideslip, the keel surface will correct the sideslip
8,166,Movement of an aircraft about its lateral axis,A,is pitching,is rolling, is yawing
8,167,Induced drag,C,is caused by skin friction,results from disturbed airflow in the region of mainplane attachments,is associated with the lift generated by an aerofoil
