Module,QuestionNo,Question,Correct Answer,Option A,Option B,Option C
8,519,In the ISA the temperature lapse rate with altitude is taken to be : . ,B,dependent on pressure and density changes.,linear.  ,non linear.       
8,520,Put in sequence from the ground up.   ,C,"tropopause, stratosphere, troposphere.  ","tropopause, troposphere, stratosphere.","troposphere, tropopause, stratosphere.  "
8,521,The International Standard Atmosphere can be described as. ,C,the atmosphere at 45 degrees north latitude.  ,the atmosphere at the equator with certain conditions.,the atmosphere which can be used Worldwide to provide comparable performance results.            
8,522,The temperature lapse rate below the tropopause is.     ,B,1°C per 1000 ft.          ,2°C per 1000 ft.   ,3°C per 1000 ft.          
8,523,Above the tropopause air pressure.                 ,B,decreases at a constant rate.    ,decreases exponentially.  ,increases exponentially.  
8,524,Which of the following is correct?.                ,B,Absolute pressure + Atmospheric pressure = Gauge pressure.           ,Absolute pressure = Gauge pressure + Atmospheric pressure.           ,Atmospheric pressure = Absolute pressure + Gauge pressure.           
8,525,As the altitude increases what happens of the ratio of Nitrogen to Oxygen?. ,C,Increases.        ,Decreases.       ,Stays the same. 
8,526,What happens to the density of air as altitude is increased?.,A,Decreases.       ,Stays the same.           ,Increases.
8,527,An aircraft is travelling at a speed of 720 nautical miles per hour. To calculate speed in MPH you.                   ,C,divide by 0.83. ,multipy by 0.83. ,multiply by 1.15. 
8,528,Lift on a delta wing aircraft.   ,A,increases with an increased angle of incidence (angle of  attack).,does not change with a change in angle of incidence (angle of attack). ,decreases with an increase in angle of incidence (angle of attack).
8,529,The CofP is the point where.              ,A,the lift can be said to act.  ,the three axis of rotation meet.           ,all the forces on an aircraft act.           
8,530,"At stall, the wingtip stagnation point.                        ",B,doesn’t move. ,moves toward the lower surface of the wing.            ,moves toward the upper surface of the wing. 
8,531,The rigging angle of incidence of an elevator is.  ,C,the angle between the bottom surface of the elevator and the longitudinal datum. ,the angle between the bottom surface of the elevator and the horizontal in the rigging position.,the angle between the mean chord line and the horizontal in the rigging position.
8,532,Which of the following is true?.                     ,A,Lift acts at right angles to the relative airflow and  weight acts vertically down.,Lift acts at right angles to the wing chord line and  weight acts vertically down. ,Lift acts at right angles to the relative air flow and  weight acts at right angles to the aircraft centre line. 
8,533,What happens to air flowing at the speed of sound when it enters a converging duct?.,C,"Velocity increases, pressure and density decreases. ","Velocity, pressure and density increase.   ","Velocity decreases, pressure and density increase. "
8,534,As the angle of attack of an airfoil increases the centre of pressure.  ,C,remains stationary.      ,moves aft.  ,moves forward.           
8,535,Vapour trails from the wingtips of an aircraft in flight are caused by.   ,A,low pressure above the wing and high pressure below the wing causing vortices.,low pressure above the wing and high pressure below the wing causing a temperature rise. ,high pressure above the wing and low pressure below the wing causing vortices. 
8,536,The chord line of a wing is a line that runs from.  ,A,the centre of the leading edge of the wing to the trailing edge.     ,half way between the upper and lower surface of the wing.,one wing tip to the other wing tip.     
8,537,The angle of incidence of a wing is an angle formed by lines.     ,A,parallel to the chord line and longitudinal axis. ,parallel to the chord line and the vertical axis.           ,parallel to the chord line and the lateral axis. 
8,538,The centre of pressure of an aerofoil is located.,C,30 - 40% of the chord line forward of the leading edge. ,50% of the chord line back from the leading edge.    ,30 - 40% of the chord line back from the leading edge.        
8,539,Compressibility effect is.     ,B,drag associated with the form of an aircraft.  ,the increase in total drag of an aerofoil in transonic flight due to the formation of shock waves.    ,drag associated with the friction of the air over the surface of the aircraft. 
8,540,A high aspect ratio wing will give.                 ,A,high profile and low induced drag.    ,low profile and high induced drag. ,ow profile and low induced drag. 
8,541,Aerofoil efficiency is defined by.                   ,A,lift over drag.  ,lift over weight.          ,drag over lift.  
8,542,"The relationship between induced drag and airspeed is, induced drag is.  ",C,directly proportional to the square of the speed.   ,directly proportional to speed.            ,inversely proportional to the square of the speed.      
8,543,What is the definition of Angle of Incidence?.   ,C,The angle the underside of the mainplane or tailplane makes with the horizontal. ,The angle the underside of the mainplane or tailplane makes with the longitudinal datum line. ,The angle the chord of the mainplane or tailplane makes with the horizontal. 
8,544,What is Boundary Layer?.    ,B,Separated layer of air forming a boundary at the leading edge.   ,Sluggish low energy air that sticks to the wing surface and gradually gets faster until it joins the free stream flow of air.       ,Turbulent air moving from the leading edge to trailing edge.            
8,545,What is the collective term for the fin and rudder and other surfaces aft of the centre of gravity that helps directional stability?.  ,C,Empennage.    ,Fuselage surfaces.       ,Effective keel surface.            
8,546,A decrease in incidence toward the wing tip may be provided to.   ,B,prevent adverse yaw in a turn.            ,retain lateral control effectiveness at high angles of attack. ,prevent span wise flow in maneuvers.            
8,547,"For a given aerofoil production lift, whereP = pressure and V = velocity.  ",A,"P1 is greater than P2, and V1 is less than V2.   ","P1 is greater than P2, and V1 is greater than V2. ",P1 is less than P2 and V1 is greater than V2.
8,548,Low wing loading.                  ,C,"increases stalling speed, landing speed and landing run. ","increases lift, stalling speed and maneuverability.   ","decreases stalling speed, landing speed and landing run.  "
8,549,"As a general rule, if the aerodynamic angle of incidence (angle of attack) of an aerofoil is slightly increased, the centre of pressure will.    ",B,move towards the tip. ,move forward towards the leading edge.       ,never move.     
8,550,The 'wing setting angle' is commonly known as. ,B,angle of dihedral.        ,angle of incidence. ,angle of attack.           
8,551,When does the angle of incidence change?.  ,A,It never changes.         ,When the aircraft attitude changes.    ,When the aircraft is ascending or descending.
8,552,"As the angle of attack decreases, what happens to the centre of pressure?. ",A,It moves rearwards.    ,Centre of pressure is not affected by angle of attack decrease.   ,It moves forward.       
8,553,A decrease in pressure over the upper surface of a wing or aerofoil is responsible for.  ,A,approximately 2/3 (two thirds) of the lift obtained.  ,approximately 1/2 (one half) of the lift obtained.       ,approximately 1/3 (one third) of the lift obtained.     
8,554,Which of the following types of drag increases as the aircraft gains altitude?.   ,C,Interference drag.       ,Parasite drag.  ,Induced drag. 
8,555,"The layer of air over the surface of an aerofoil which is slower moving, in relation to the rest of the airflow, is known as.                ",C,none of the above.      ,camber layer.   ,boundary layer.  
8,556,What is a controlling factor of turbulence and skin friction?. ,A,Countersunk rivets used on skin exterior.  ,Aspect ratio.    ,Fineness ratio. 
8,557,If the C of G is aft of the Centre of Pressure.,B,when the aircraft yaws the aerodynamic forces acting forward of the Centre of Pressure.   ,changes in lift produce a pitching moment which acts to increase the change in lift.  ,"when the aircraft sideslips, the C of G causes the nose to turn into the sideslip thus applying a restoring moment.       "
8,558,The upper part of the wing in comparison to the lower.     ,C,develops less lift.        ,develops the same lift.            ,develops more lift.
8,559,What effect would a forward CG have on an aircraft on landing?. ,A,Increase stalling speed.           ,Reduce stalling speed.            ,No effect on landing.  
8,560,QNH refers to.     ,C,quite near horizon.      ,setting the altimeter to zero. ,setting the mean sea level atmospheric pressure so an altimeter reads the aerodrome altitude above mean sea level.            
8,561,QNE refers to.           ,A,setting the mean sea level atmospheric pressure in accordance with ICAO standard atmosphere i.e. 1013 millibars.,Setting an altimeter to read aerodrome altitude above sea level. ,quite new equipment. 
8,562,An aspect ratio of 8 : 1 would mean.   ,A,"span 64, mean chord 8.","mean chord 64, span 8.           ","span squared 64, chord 8.       "
8,563,QFE is.      ,A,airfield pressure.          ,difference between sea level and airfield pressure. ,sea level pressure.
8,564,"For any given speed, a decrease in aircraft weight, the induced drag will.",A,decrease.         ,remain the same.         ,increase.          
8,565,The amount of lift generated by a wing is.   ,C,greatest at the tip.       ,constant along the span.  ,greatest at the root.     
8,566,Induced Drag is.      ,A,greatest towards the tip and downwash decreases from tip to root.  ,greatest towards the wing tip and downwash is greatest towards the root. ,greatest towards the wing root and downwash is greatest at the tip.   
8,567,Induced Drag is.      ,B,never equal to profile drag.     ,equal to profile drag at Vmd.,equal to profile drag at stalling angle. 
8,568,With an increase in aircraft weight.   ,A,Vmd will be at a higher speed.           ,Vmd will be at the same speed.          ,Vmd will be at a lower speed.  
8,569,For a given IAS an increase in altitude will result in.  ,A,an increase in induced drag.   ,no change in the value of induced drag. ,an increase in profile drag.      
8,570,Stall inducers may be fitted to a wing.  ,A,at the root to cause the root to stall first.  ,at the tip to cause the root to stall first.          ,at the root to cause the tip to stall first.          
8,571,The optimum angle of attack of an aerofoil is the angle at which.                 ,C,the aerofoil produces maximum lift.  ,the aerofoil produces zero lift.            ,the highest lift/drag ratio is produced.            
8,572,Minimum total drag of an aircraft occurs.                  ,C,when induced drag is least.    ,at the stalling speed.   ,when profile drag equals induced drag.         
8,573,"If the weight of an aircraft is increased, the induced drag at a given speed. ",A,will increase.   ,will decrease.  ,will remain the same. 
8,574,The transition point on a wing is the point where. ,A,the boundary layer flow changes from laminar to turbulent.,the flow divides to pass above and below the wing. ,the flow separates from the wing surface.      
8,575,A laminar boundary layer will produce.   ,C,more skin friction drag than a turbulent one.,the same skin friction drag as a turbulent one.           ,less skin friction drag than a turbulent one. 
8,576,The boundary layer is.   ,B,thickest at the leading edge.   ,thickest at the trailing edge.  ,constant thickness from leading to trailing edges.  
8,577,The amount of thrust produced by a jet engine or a propeller can be calculated using.  ,B,Newton’s 3rd law.  ,Newton’s 2nd law.     ,Newton’s 1st law.       
8,578,An engine which produces an efflux of high speed will be. ,A,less efficient.   ,more efficient. ,speed of efflux has no affect on the engine efficiency. 
8,579,Wing loading is calculated by weight.  ,B,divided by lift.            ,divided by gross wing area.,multiplied by gross wing area.            
8,580,Induced drag is.    ,C,nothing to do with speed.       ,proportional to speed. ,inversely proportional to the square of speed.            
8,581,As the angle of attack increases the stagnation point.,C,moves towards the upper surface. ,does not move.            ,moves towards the lower surface. 
8,582,The term pitch-up is due to.                ,C,compressibility effect. ,ground effect. ,longitudinal instability.           
8,583,"In a steady climb at a steady IAS, the TAS is.                       ",A,more than IAS.  ,the same.,less than IAS.  
8,584,An untapered straight wing will.                    ,B,have no yaw effect in banking.           ,stall at the root first.    ,have no change in induced drag in the bank.
8,586,"With the ailerons away from the neutral, induced drag is.    ",C,higher on the lower wing plus profile drag increases.,unchanged but profile drag is higher. ,higher on the upper wing plus profile drag increases.
8,587,All the lift can be said to act through the.  ,A,centre of pressure.       ,centre of gravity.,normal axis.     
8,588,The concept of thrust is explained by.        ,B,Bernoulli’s theorem.    ,Newton’s 3rd law.      ,Newton’s 1st law.       
8,589,The camber of an aerofoil section is.  ,B,the angle which the aerofoil makes with the relative airflow.  ,the curvature of the median line of the aerofoil. ,the angle of incidence towards the tip of a wing.   
8,590,"As air flows over the upper cambered surface of an aerofoil, what happens to velocity and pressure?.  ",B,"Velocity increases, pressure increases.","Velocity increases, pressure decreases. ","Velocity decreases, pressure decreases. "
8,591,What is the force that tends to pull an aircraft down towards the earth?.   ,B,Thrust. ,Weight.           ,Drag. 
8,592,The angle at which the chord line of the aerofoil is presented to the airflow is known as.                    ,A,angle of attack.           ,resultant.    ,angle of incidence. 
8,593,The imaginary straight line which passes through an aerofoil section from leading edge to trailing edge is called.  ,A,the chord line. ,the direction of relative airflow.   ,centre of pressure.       
8,594,"What is the angle between the chord line of the wing, and the longitudinal axis of the aircraft, known as?.  ",C,Angle of dihedral. ,Angle of attack.          ,Angle of incidence. 
8,595,Wing tip vortices create a type of drag known as.    ,C,form drag.       ,profile drag.    ,induced drag.  
8,596,Which of the following describes the 'Empennage'?.  ,A,"Tail section of the aircraft, including fin, rudder, tail plane and elevators.    ","Nose section of an aircraft, including the cockpit. ","The wings, including the ailerons."
8,597,"As the angle of attack is increased (up to the stall point), which of the following is correct?.                      ",A,Both a) and b) are correct.  ,Pressure difference between top and bottom of the wing increases.,Lift increases.  
8,598,"What type of drag, depends on the smoothness of the body, and surface area over which the air flows?.   ",C,Form drag.      ,Parasite drag.  ,Skin friction drag.       
8,599,"When airflow velocity over an upper cambered surface of an aerofoil decreases, what takes place?.                ",B,"Pressure decreases, lift increases.        ","Pressure increases, lift decreases.        ","Pressure increases, lift increases.   "
8,600,When an aircraft stalls.       ,C,lift increases and drag decreases.        ,lift and drag increase. ,lift decreases and drag increases.  
8,601,An aircraft wing with an aspect ration of 6 : 1 is proportional so that.     ,C,the wing area is six times the span.     ,the mean chord is six times the thickness.,the wing span is six times the mean chord.
8,602,Upward and outward inclination of a mainplane is termed.  ,A,dihedral.,sweep.,stagger.  
8,603,Which of the following forces act on an aircraft in level flight?.     ,C,"Lift, drag, thrust. ","Lift, thrust, and weight.          ","Lift, thrust, weight, and drag.   "
8,604,"With reference to altimeters, QFE is.             ",C,the manufacturers registered name.  ,quite fine equipment.  ,setting aerodrome atmospheric pressure so that an altimeter reads zero on landing and take off. 
8,605,Under the ICAO 'Q' code there are which three settings?. ,C,"QEF, QNH, QEN.","QE, QN, QQE.           ","QFE, QNH, QNE.  "
8,606,Wing loading is.                      ,B,WING AREA * WING CHORD.,GROSS WEIGHT divided by GROSS WING AREA.  ,the ultimate tensile strength of the wing.       
8,607,Weight is equal to.  ,B,mass * acceleration.  ,mass * gravity.            ,volume * gravity. 
8,608,Induced drag.             ,A,increases with increase in aircraft weight.  ,increases with an increase in speed.    ,reduces with an increase in angle of attack.   
8,609,Airflow over the upper surface of the wing generally.    ,B,flows towards the tip. , flows towards the root.  ,flows straight from leading edge to trailing edge.   
8,610,"With an increase in aspect ratio for a given IAS, induced drag will.             ",A,reduce.            ,remain constant.,increase.          
8,611,"If the density of the air is increased, the lift will.     ",B,remain the same. ,increase.          ,decrease.         
8,612,All the factors that affect the lift produced by an aerofoil are.     ,A,"angle of attack, velocity, wing area, aerofoil shape, air density.        ","angle of attack, air temperature, velocity, wing area. ","angle of attack, air density, velocity, wing area. "
8,613,A wing section suitable for high speed would be.    ,C,thin with high camber.   ,thick with high camber.          ,thin with little or no camber. 
8,614,The induced drag of an aircraft.      ,B,increases if aspect ratio is increased.,decreases with increasing speed.        ,increases with increasing speed.  
8,615,"As the speed of an aircraft increases, the profile drag.   ",B,decreases at first then increase.           ,increases.         ,decreases. 
8,616,The stagnation point on an aerofoil is the point where.,C,the boundary layer changes from laminar to turbulent.   ,the suction pressure reaches a maximum.       ,the airflow is brought completely to rest.       
8,617,The stalling of an aerofoil is affected by the. ,C,transition speed. ,airspeed.          ,angle of attack. 
8,618,The most fuel efficient of the following types of engine is the.    ,B,turbo-jet engine.          ,turbo-fan engine.  ,rocket. 
8,619,The quietest of the following types of engine is the.    ,C,turbo-jet engine. ,rocket. ,turbo-fan engine.         
8,620,Forward motion of a glider is provided by.                ,A,the weight.      ,the drag.  ,the engine.     
8,621,Profile drag consists of what drag types?.   ,C,"Form, induced and interference.   ","Form, induced and skin friction.        ","Form, skin friction and interference.  "
8,622,An aircraft in straight and level flight is subject to.               ,A,a load factor of 1.       ,a load factor of  ½. ,zero load factor.          
8,623,Aspect ratio is given by the formula.              ,C,Mean Chord / Span.    ,Span2 / Area. ,Span2 / Mean Chord.   
8,624,An aspect ratio of 8 means.    ,B,the mean chord is 8 times the span.    ,the span is 8 times the mean chord.    ,the area is 8 times the span. 
8,625,A high aspect ratio wing.                    ,C,has a higher stall angle than a low aspect ratio wing.,is stiffer than a low aspect ratio wing.  ,has less induced drag than a low aspect ratio wing.   
8,626,Induced downwash.               ,A,reduces the effective angle of attack of the wing. ,increases the effective angle of attack of the wing.   ,has no effect on the angle of attack of the wing.       
8,627,"Given 2 wings, the first with a span of 12m and a chord of 2 m. The second has a span of 6m and a chord of 1m. How do their Aspect Ratios compare?.  ",B,The first is higher.   ,They are the same.      ,The second is higher. 
8,628,The C of G moves in flight. The most likely cause of this is.    ,B,movement of passengers.        ,consumption of fuel and oils.,movement of cargo.    
8,629,"A straight rectangular wing, without any twist, will.   ",C,stall equally along the span of the wing. ,stall first at the tip.  ,stall first at the root. 
8,630,When an aircraft experiences induced drag.               ,C,air flows under the wing span wise towards the root and on top of the wing span wise towards the tip.  ,air flows under the wing span wise towards the tip and on top of the wing span wise towards the root. ,Neither a) or b) since induced drag does not cause span wise flow.  
8,631,Aspect ratio of a wing is defined as the ratio of the. ,A,wingspan to the mean chord.,wingspan to the wing root.     ,square of the chord to the wingspan.
8,632,Which of the following is true?.,A,Lift acts at right angles to the relative airflow and weight acts vertically down. ,Lift acts at right angles to the wing chord line and weight acts vertically down. ,Lift acts at right angles to the relative air flow and weight acts at right angles to the aircraft centre line.
8,633,The airflow over the upper surface of a cambered wing.  ,A,increases in velocity and reduces in pressure. ,increases in velocity and pressure.      ,reduces in velocity and increases in pressure. 
8,634,With increased speed in level flight. ,A,profile drag increases.,induced drag increases.           ,profile drag remains constant. 
8,635,An aeroplane wing is designed to produce lift resulting from relatively.  ,C,positive air pressure below the wing's surface and negative air pressure above the wing's surface.,negative air pressure below the wing's surface and  positive air pressure above the wing's surface. ,positive air pressure below and above the wing's surface.   
8,636,The angle of attack of an aerofoil section is the angle between the.   ,B,underside of the wing surface and the mean airflow. ,chord line and the relative airflow.    ,chord line and the centre line of the fuselage.            
8,637,A swept wing tends to stall first at the.                      ,C,centre section. ,root.     ,tip.
8,638,The trailing vortex on a pointed wing (taper ratio = 0) is.  ,C,at the tip.         ,equally all along the wing span. ,at the root.       
8,639,The lift curve for a delta wing is.                    ,B,more steep than that of a high aspect ratio wing.  ,Less steep than that of a high aspect ratio wing. ,the same as that of a high aspect ratio wing. 
8,640,A delta wing has.                    ,B, a lower stall angle than a straight wing.   ,a higher stall angle than a straight wing.  ,the same stall angle than a straight wing.   
8,641,The airflow over the upper surface of a cambered wing.     ,B,reduces in velocity and increases in pressure. ,increases in velocity and reduces in pressure. ,increases in velocity and pressure. 
8,642,The speed of air over a swept wing which contributes to the lift is.  ,A,less than the aircraft speed.     ,the same as the aircraft speed.            ,more than the aircraft speed.  
8,643,"For a given angle of attack, induced drag is.              ",C,greater on a high aspect ratio wing.    ,greater towards the wing root.    ,greater on a low aspect ratio wing.     
8,644,"In straight and level flight, the angle of attack of a swept wing is.    ",A,less than the aircraft angle to the horizontal.  ,more than the aircraft angle to the horizontal.            ,the same as the aircraft angle to the horizontal.
