Module,QuestionNo,Question,Correct Answer,Option A,Option B,Option C
8,776,A balance tab.   ,B,effectively increases the area of the control surface. ,assists the pilot to move the controls. ,is used to trim the appropriate axis of the aircraft.  
8,777,Elevons combine the functions of both.   ,B,rudder and elevator.    ,elevator and aileron.    ,rudder and aileron.      
8,778,Flutter can be reduced by using.      ,B,a horn balance.            ,mass balancing.  ,servo tabs.       
8,779,An elevator provides control about the.                     ,B,longitudinal axis.         ,lateral axis.      ,horizontal stabilizer.    
8,780,The outboard ailerons on some large aircraft.             ,A,are isolated at high speeds. ,are isolated to improve sensitivity.     ,are isolated at low speeds.   
8,781,Which wing increases drag when the ailerons are moved?.    , C,Both wings increase drag but the wing with the up-going aileron  increases more. ,Both wings have an equal increase in drag.   ,Both wings increase drag but the wing with the down-going aileron increases more.
8,782,Which flap will increase wing area and camber?.   ,C,Slot.     ,Split.    ,Fowler.            
8,783,Wing loading of an aircraft.                ,B,varies with dynamic loading due to air currents. ,is independent of altitude.      ,decreases with density.    
8,784,An automatic slat will lift by itself when the angle of attack is.     ,A,high.    ,high or low.     ,low.
8,785,"On aircraft fitted with spoilers for lateral control, roll to the right is caused by.  ",C,"left spoilers extending, right spoilers remaining retracted. ","right spoilers extending, left spoilers remaining retracted.   ",left and right spoilers extending.        
8,786,A split flap increases lift by increasing.    ,A,the angle of attachment of the lower hinged portion.     ,the surface area.          ,the camber of the top surface. 
8,787,"When the trailing edge flaps are lowered, the aircraft will.   ",B,pitch nose up.  ,pitch nose down.,sink.     
8,788,In aileron control.                    ,A,the up going aileron moves further than down going aileron.,the down going aileron moves further than up going aileron. ,it is assisted by the rudder.  
8,789,The aircraft is controlled about the lateral axis by the.   ,B,ailerons.           ,elevator.          ,rudder.   
8,790,The aircraft is controlled about the normal axis by the.   ,C,ailerons.           ,elevator.,rudder.            
8,791,Dutch roll is.     ,A,a combined yawing and rolling motion.         ,primarily a pitching instability.           ,a type of slow roll.    
8,792,The aircraft is controlled about the longitudinal axis by the.             ,A,ailerons.           ,elevator.          ,rudder.            
8,793,"Ruddervators when moved, will move.                      ",C,opposite to each other only.    ,together only.  ,"either opposite each other or together, depending on the selection.   "
8,794,As a consequence of the C of G being close to its aft limit. ,C,"the stick forces will be high in fore and aft pitch, due to the high longitudinal stability.",the stick forces to manoeuvre longitudinally will be low  due to the low stability.   ,the stick forces when pitching the nose down will be very high. 
8,795,What is the term used for the amount of water in the atmosphere?.   ,B,Relative humidity.   ,Absolute humidity.     ,Dew point.      
8,796,An anti-balance tab is moved.                        ,A,via a fixed linkage.   ,hydraulically.  ,when the C.G. changes.    
8,797,A servo tab is operated.      ,A,directly by the pilot to produce forces which in turn move the main control surfaces. ,"automatically, and moves in the same direction as the  main control surfaces.",by a trim wheel and moves in the opposite direction to  the main control surfaces when moved. 
8,798,"On an aircraft with an all-moving tailplane, pitch up is caused by. ",A,decreasing tailplane incidence.    ,up movement of the elevator trim tab.  ,increasing tailplane incidence.   
8,799,"When checking full range of control surface movement, they must be positioned by.                        ",C,moving them by hand directly until against the primary stops.,moving them by hand directly until against the secondary stops. ,operating the control cabin controls until the system is against the primary stops.
8,800,An excess of aerodynamic balance would move the control surface centre of pressure.    ,C,"rearwards, resulting in too much assistance.","rearwards, resulting in loss of assistance.       ","forwards, resulting in an unstable overbalance.          "
8,801,A flying control mass balance weight. ,B,keeps the control surface C of G as close to the trailing edge as  possible. ,tends to move the control surface C of G close to the hinge line. ,ensures that the C of G always acts to aid the pilot thus relieving control column load. 
8,802,The type of flap which extends rearwards when lowered is called a.  ,C,plain flap.  ,split flap.         ,Fowler flap.     
8,803,Which of the following trailing edge flaps give an increase in wing area?.   ,B,Split flap.        ,Fowler flap.     ,Slotted flap.   
8,804,Which of the following is not a primary flying control?. ,B,Elevator.          ,Tailplane.,Rudder.           
8,805,A leading edge slat is a device for.  ,A,increasing the stalling angle of the wing.,decreasing the stalling angle of the wing.       ,decreasing wing drag. 
8,806,A Krueger flap is.     ,B,a flap which extends rearwards but does not lower.,a leading edge flap which hinges forward.     ,a leading edge slat which extends forward.   
8,807,A tab which assists the pilot to move a flying control by moving automatically in the opposite direction to the control surface is called a.               ,B,servo tab.  ,geared balance tab.     ,trim tab.           
8,808,What is attached to the rear of the vertical stabilizer?.     ,C,Elevator.          ,Aileron.           ,Rudder.           
8,809,"What is fitted on the aircraft to enable the pilot to reduce his speed rapidly in event of severe turbulence, or speed tending to rise above the Never Exceed Limit?.",B,Lift dumpers.  ,Air brakes.,Wheel brakes.  
8,810,"When spoilers are used asymmetrically, they combine with.    ",A,ailerons.    ,rudder.            ,elevators.         
8,811,What is used to correct any tendency of the aircraft to move towards an undesirable flight attitude?.  ,A,Trim tabs.        ,Spring tabs.,Balance tabs.   
8,812,"The layer of air over the surface of an aerofoil which is slower moving, in relation to the rest of the airflow, is known as.    ",C,none of the above are correct. ,camber layer.,boundary layer. 
8,813,A control surface which forms a slot when deployed is called a.                  ,A,slat.      ,slot.,flap.     
8,814,Asymmetric flaps will cause.              ,C,the aircraft to descend.           ,the aircraft to ascend.,one wing to rise.          
8,815,"When airflow velocity over an upper cambered surface of an aerofoil decreases, what takes place?. ",B,"Pressure decreases, lift increases.        ","Pressure increases, lift decreases.        ","Pressure increases, lift increases. "
8,816,What is a controlling factor of turbulence and skin friction?.    ,A,Countersunk rivets used on skin exterior.       ,Aspect ratio.    ,Fineness ratio. 
8,817,Changes in aircraft weight.                 ,A,cause corresponding changes in total drag due to the associated lift change.   ,will not affect total drag since it is dependant only upon speed.,will only affect total drag if the lift is kept constant. 
8,818,When an aircraft stalls.                       ,C,lift increases and drag decreases.   ,lift and drag increase.,lift decreases and drag increases.        
8,819,Spoiler panels are positioned so that when deployed.                        ,B,roll will not occur.,pitch trim is not affected.       ,no yaw takes place. 
8,820,The aircraft stalling speed will.      ,C,only change if the MTWA were changed.      ,be unaffected by aircraft weight changes since it is dependant upon the angle of attack.,increase with an increase in weight.
8,821,In a bank and turn.    ,C,extra lift is not required if thrust is increased. ,extra lift is not required.         ,extra lift is required.    
8,822,The method employed to mass balance control surfaces is to.                       ,B,fit bias strips to the trailing edge of the surfaces.  ,attach weights forward of the hinge line.   ,allow the leading edge of the surface to project into the airflow.      
8,823,Control surface flutter may be caused by.        ,A,excessive play in trim tab attachments.           ,high static friction in trim tab control tabs.     ,incorrect angular movement of trim tabs.       
8,824,A differential aileron control system results in. ,B,aileron drag being reduced on the inner wing in a turn.         ,aileron drag being reduced on the outer wing in a turn.    ,aileron drag being compensated by small rudder movements.   
8,825,The primary function of a flap is.  ,C,to trim the aircraft longitudinally.  ,to alter the position of the centre of gravity.  ,to alter the lift of an aerofoil.  
8,826,The angle of attack at which stall occurs.   ,A,can be varied by using flaps and slats.   ,depends on the weight of the aircraft.            ,"cannot be varied, it is always constant.          "
8,827,The stalling speed of an aircraft.                     ,A,is increased when it is heavier.     ,does not change.         ,is increased when it is lighter. 
8,828,A wing flap which has dropped or partially extended on one wing in flight will lead to. ,C,a fixed banked attitude which would be corrected by use of the rudder. ,a pitching moment which would be corrected by used of the elevators. ,a steady rolling tendency which would be corrected by use of the ailerons.
8,829,"With an increase in the amount of flap deployment, the stalling angle of a wing.   ",C,remains the same.        ,increases.         ,decreases.   
8,830,Aerodynamic balance of a control surface may be achieved. ,A,by a horn at the extremity of the surface forward of the hinge line.  ,by weights added to the control surface aft of the hinge line.   ,by a trimming strip at the trailing edge of the surface.   
8,831,A control surface is provided with aerodynamic balancing to.                      ,A,assist the pilot in moving the control. ,increase stability.         ,decrease the drag when the control is deflected.  
8,832,Downward displacement of an aileron.         ,B,increases the angle at which its wing stalls. ,decreases the angle at which its wing will stall.         ,"has no effect on its wing stalling angle, it only affects the stalling speed on that wing."
8,833,"Due to the tailplane angle of attack change, the flap-induced downwash on the tailplane.",A,will tend to cause an aircraft nose-up pitch.,may cause a nose-down or nose-up pitch depending upon the initial tailplane load .  ,will tend to cause an aircraft nose down pitch.  
8,834,"Due to the change in lift coefficient accompanying extension of the flaps, to maintain the lift constant it would be necessary to.                  ",B,raise the nose.  ,lower the nose. ,keep the pitch attitude constant.         
8,835,"The extension to the rudder (shaded portion shown on the diagram), is provided to.   ",B,make the pilot aware of the aerodynamic forces encountered when moving the control.     ,provide aerodynamic assistance for the pilot when moving the rudder.   ,prevent control surface flutter.           
8,836,A differential aileron control is one which gives.  ,C,the down-going aileron more travel than the up-going one. ,"equal aileron travel in each direction, but variable for stick movement.     ",a larger aileron up travel than down. 
8,837,Which leading edge device improves the laminar flow over the wing?. ,B,Flap and slat.,Slat.,Flap.    
8,838,The balance tab is an auxiliary surface fitted to a main control surface. ,A,operating automatically to assist the pilot in moving the controls.     ,operated independently at which point in the length of cable the tensiometer is applied. ,operating automatically to provide feel to the controls.    
8,839,Aerodynamic balancing of flight controls is achieved by.     ,C,placing a weight ahead of the hinge point.     ,placing a weight in the leading edge of the control surface. ,providing a portion of the control surface ahead of the hinge point. 
8,840,Aerodynamic balance is used to.    ,B,reduce the control load to zero.   ,make the flying controls easier to move.        ,prevent flutter of the flying controls.
8,841,A horn balance is. ,C,a rod projecting forward from the control surface with a weight on the end.    ,a rod projecting upward from the main control surface to which the control cables are attached.,a projection of the outer edge of the control surface forward of the hinge line.   
8,842,A control surface is mass balanced by.   ,C,the attachment of weights acting on the hinge line. ,fitting a balance tab.   ,the attachment of weights acting forward of the hinge line.  
8,843,The purpose of anti-balance tabs is to.                        ,C,relieve stick loads.       ,trim the aircraft.          ,give more feel to the control column. 
8,844,You have adjusted the elevator trim tab to correct for nose heavy. What was the direction of travel of the trim tab?.  ,C,The elevator trim tab has moved down.         ,The elevator trim tab has moved up.   ,The port elevator tab has moved up and starboard moved down. 
8,845,The tropopause exists at about.  ,C,"18,000 ft.        ","30,000 ft.        ","36,000 ft.        "
8,846,Induced drag curve characteristics of a slender delta wing are such that there is.                 ,C,an increase in gradient with wing speed.        ,no change in gradient with wing speed. ,decrease in gradient with wing speed.   
8,847,Instability giving roll and yaw.  ,A,is dutch roll.    ,is longitudinal stability.  ,is lateral stability.        
8,848,Vortex generators are fitted to.     ,B,move transition point rearwards. ,move transition point forwards.          ,advance the onset of flow separation.            
8,849,Leading edge flaps. ,A,increase stalling angle of the wing. ,decrease stalling angle of the wing.    ,do not change the stalling angle.        
8,850,Krueger flaps are on. ,A,the leading edge.         ,either the leading or training edge. ,the trailing edge.         
8,851,Sweepback will.                      ,C,decrease lateral stability. ,not affect lateral stability.       ,increase lateral stability.          
8,852,A plain flap.   ,A,does not increase the wing area on deployment.   ,is attached to the leading edge of the wing.   ,forms part of lower trailing edge.       
8,853,"A split flap, when deployed.              ",C,is used only on high speed aircraft. ,increases lift without a corresponding increase in drag. ,"increases drag with little lift coefficient increase, from intermediate to fully down. "
8,854,A flying control mass balance weight.                        ,B,keeps the control surface C of G as close to the trailing edge as possible.   ,tends to move the control surface C of G close to the hinge line.  ,tends to move the control surface C of G forward of the hinge line.      
8,855,An elevator controls the aircraft motion in.   ,C,yaw.    ,roll.      ,pitch.   
8,856,Air above Mach 0.7 is. ,C,compressible only when above the speed of sound.,incompressible.            ,compressible.
8,857,Supersonic air passing through a divergent duct causes the.   ,C,"pressure to increase, velocity to increase.       ","pressure to increase, velocity to decrease.      ","pressure to decrease, velocity to increase. "
8,858,An aircraft flying below the tropopause descends at a constant True Airspeed. Its Mach. No. will.  ,B,not change.      ,decrease.         ,increase.
8,859,A nose down change of trim (tuck-under) occurs due to shock induced. ,B,tip stall on a delta wing aircraft.    ,root stall on a delta wing aircraft.       ,tip stall on a straight wing aircraft.     
8,860,A symmetrical aerofoil is accelerating through Mach 1 with an angle of attack of 0°. A shock wave will form.  ,B,on the upper and lower surface and will move aft until the point of maximum camber.,on the upper and lower surface and will move aft.  ,on the upper surface only and move aft.        
8,861,Shock stall.                  ,A,occurs at high speeds. ,is a flap down stall and occurs at high speeds.,occurs at low speeds.  
8,862,As you approach supersonic speed.                ,B,thrust is reduced.        ,total drag is increased.            ,lift is reduced. 
8,863,Mach trim in some aircraft assists.   ,C,lateral stability.            ,vertical stability. ,longitudinal stability.  
8,864,Before an aircraft reaches critical mach. ,C,the nose pitches up because the CP moves Forward. ,the aircraft buffets because the CP moves to the shock wave.  ,the nose pitches down because the CP moves rear.  
8,865,"On a standard day, at which altitude will the speed of sound be the greatest?.",C,"20,000 ft.   ","10,000 ft.        ",Sea level.         
8,866,Which of the following will increase the Critical Mach Number of an aerofoil?.  ,A,Using a thin airfoil and sweeping the wings back. ,Decreasing the fineness ratio of the wings.    ,Increasing the aspect ratio of the wings.        
8,867,"As an aircraft accelerates through the transonic region, the centre of pressure tends to. ",B,turn into a shock wave.       ,move rearward.           ,move forward. 
8,868,Supersonic air going through an incipient shock wave will decrease its speed and.,C,decrease temperature and increase density. ,increase temperature and decrease density.    ,increase temperature and increase density. 
8,869,An increase in mach number will cause the.   ,C,CofP to move rearwards giving more downwash on the tail plane.,CofP to move forwards giving less downwash on the tail plane.   ,CofP to move rearwards giving less downwash on the tail plane.
8,870,"At speeds above Mach 1, shockwaves will form above and below the wing.  ",B,at the trailing edge.   ,at both the leading edge and the trailing edge.  ,at the leading edge.     
8,871,"Above the critical mach number, the drag coefficient.  ",A,increases.         ,remains the same.,decreases.        
8,872,Mach trim counters.                ,A,longitudinal instability.  ,vertical instability.       ,lateral instability. 
8,873,"At high Mach Numbers above Mach 2.2, some aircraft metals.                     ",B,"such as aluminium, become brittle.",lose their strength due to the kinetic heating effect.  ,will shrink due to the extreme pressures involved.     
8,874,Mach trim operates.  ,A,along the longitudinal axis.     ,along the lateral axis.,to reduce Dutch roll.   
8,875,To increase critical mach number.  ,A,the wings are swept.  ,elevons are fitted.       ,tailerons are fitted.   
8,876,When approaching the speed of sound the. ,A,pressure above the wing exceeds the pressure below the wing in places. ,pressure above the wing can never exceed the pressure below the wing.      ,pressure above the wing equals the pressure below the wing.            
8,877,"Airspeeds above the speed of sound, but not exceeding 4 times the speed of sound are.                  ",A,supersonic.      ,hypersonic.      ,hyposonic.       
8,878,"An aircraft experiences a large loss of lift and a big increase in drag in straight and level flight, what would be the most probable cause?.  ",B,Atmospheric conditions.         ,Aircraft reached its critical mach number. ,Severe head winds.     
8,879,A Mach Trimmer is a device which.               ,B,prevents the aircraft from exceeding its critical Mach No.     ,automatically compensates for trim changes in the transonic region. ,switches out trim control to prevent damage in the transonic speed range.  
8,880,Mach trim usually operates between.              , B,0.9 mach and 0.99 mach.  ,0.7 and 0.8 mach.        ,0.6 mach 0.7 mach.  
8,881,Mach trimming is initiated by an input signal from the.   ,B,IRS.     ,vertical gyro.   ,CADC.            
8,882,Mach trim prevents.                ,B,the nose dropping in a low speed turn.  ,the nose dropping at high speed.        ,the nose lifting at high speed.
8,883,Critical Mach No. may be increased by. ,B,using a higher thickness/chord ratio wing. ,sweeping back the wing.         ,using more powerful engines. 
8,884,Airflow either side of a normal shock wave is.   ,B,sonic upstream and downstream.  ,"sonic upstream, subsonic downstream.           ","subsonic upstream, sonic downstream.           "
8,885,Mach Number is defined as.     ,C,speed of sound at sea level divided by local speed of sound.  ,IAS divided by the local speed of sound. ,TAS divided by local speed of sound.   
8,886,The reason for sharp leading edged wings on high speed aircraft is to.  ,A,enable the shockwave to be accurately positioned. ,decrease wave drag.    ,decrease boundary layer.        
8,887,Critical Mach Number is defined as.    ,B,that number at which the airflow becomes supersonic.          ,that free-stream Mach Number at which some part of the airflow over the aircraft becomes sonic.,the minimum mach number at which the aircraft can go supersonic. 
8,888,The transonic region is a region of.  ,C,all subsonic.     ,all supersonic.,mixed airflow. 
8,889,Immediately downstream of an oblique shockwave is always.                      ,A,supersonic.      ,the same as upstream. ,subsonic.         
8,890,Wave drag.                  ,C,increases in the supersonic region.  ,increases at the low speed stall.          ,increases in the transonic region.        
8,891,For increased Mcrit.  ,A,decrease thickness/chord ratio.,decrease sweepback.   ,decrease true airspeed.            
8,892,Symptoms of shock stall are. ,B,"decrease in speed, buffet and movement of the centre of pressure.   ","buffet, loss of control, and instability.","compressibility effects, buffet and loss of control.  "
8,893,Sweepback increases Mcrit by.                       ,B,decreasing the amount of airflow over the lowest point on the aerofoil section.       ,decreasing the amount of airflow over the highest point on the aerofoil section.      ,increasing the amount of airflow over the highest point on the aerofoil section.
8,894,Mach number is.                      ,A,the ratio of the aircrafts TAS to the speed of sound at the same atmospheric conditions.    ,the ratio of the aircrafts IAS to the speed of sound at the same atmospheric conditions.     ,the ratio of the aircrafts TAS to the speed of sound at sea level. 
8,895,The critical Mach number is.     ,C,the Mach No. when a shock wave forms at the leading edge.,the Mach No. when the aircraft reaches the speed of sound.,the aircraft Mach. No. when the airflow reaches the speed of sound at some point on the aircraft.
8,896,Above the Critical Mach No. the drag coefficient will.  ,B,remain the same. ,start to increase.          ,start to decrease.   
8,897,"A wing of low thickness/chord ratio, the Critical Mach No. will be. ",B,lower than a wing of high thickness/chord ratio.        ,higher than a wing of high thickness/chord ratio.   ,the same as a wing of high thickness/chord ratio. 
8,898,An aeroplane flying above the Critical Mach No. will usually experience.    ,C,a nose up pitch.           ,an oscillation in pitch.,a nose down pitch       
8,899,Tuck-under can be counteracted by.  ,A,mach trim.       ,aileron reversal.           ,trim tabs.         
8,900,What causes tuckunder?.                    ,C,Flap back effect.   ,Shock stall.      ,Aileron reversal.  
